AREA,CODE
"Rosemont North, Orlando, FL",12698
"Rosemont West, Tucson, AZ",5460
"Rosemont, Baltimore, MD",5541
"Rosemont, Fort Worth, TX",2874
"Rosemont, Orlando, FL",12031
"Rosemont, Portland, ME",3798
"Rosemoor, Chicago, IL",900
"Roseville - Fleet Ridge, San Diego, CA",1304
"Roseville Corner, Celebration, FL",11087
"Roseville Heights, Roseville, CA",4785
"Roseway, Portland, OR",3408
"Rosewood Village, Ypsilanti, MI",11180
"Rosewood, Austin, TX",11922
"Rosewood, Lake Oswego, OR",5389
"Rosewood, Tulsa, OK",5174
"Roslindale, Boston, MA",2509
"Ross Center, Evansville, IN",10672
"Ross, Lancaster, PA",1998
"Rossborough, Fort Collins, CO",14749
"Rossmoyne, Glendale, CA",3024
"Rossville, NY, NY",797
"Rotary Park, Mesa, AZ",5226
"Rothfield, Semmes, AL",5102
"Rothwell Heights, Columbia, MO",10764
"Roundhill, Roanoke, VA",2070
"Rountree-Walnut, Springfield, MO",11295
"Route 66 West, Albuquerque, NM",12519
"Rowena Gardens, Orlando, FL",13554
"Rowley Downs, Parker, CO",14956
"Roxboro Forest, Brookhaven, GA",11124
"Roxborough Park, Philadelphia, PA",9789
"Roxborough, Nashville, TN",8360
"Roxborough, Philadelphia, PA",283
"Roxbury, Boston, MA",2458
"Roxbury, NY, NY",13543
"Roxbury, Stamford, CT",6006
"Roxhill, Seattle, WA",3749
"Royal Gardens, Gainesville, FL",14575
"Royal Harbor, Naples, FL",1714
"Royal Lakes, Jacksonville, FL",12545
"Royal Meadows, Midwest City, OK",10870
"Royal Oaks, Beaufort, SC",1938
"Royal Oaks, Fort Wayne, IN",7598
"Royal Oaks, Kansas City, MO",12694
"Royal Oaks, Nashville, TN",8571
"Royal Oaks, South Brunswick, NJ",8872
"Royal Palm Acres, Oakland Park, FL",9841
"Royal Palm Isles, Oakland Park, FL",13986
"Royal Palms, Mesa, AZ",6494
"Royal Poinciana, Hollywood, FL",1403
"Royal Poinciana, Lake Worth, FL",11057
"Royal Ridge, San Antonio, TX",12619
"Royal Terrace, Jacksonville, FL",12247
"Royal View, San Antonio, TX",15636
"RP Sports Complex, Sacramento, CA",4381
"Ruby Hill, Denver, CO",2901
"Rudee Heights, Virginia Beach, VA",6888
"Rue Royal, Atlanta, GA",13690
"Rufus King, Milwaukee, WI",3672
"Rum Village, South Bend, IN",15676
"Rumford, East Providence, RI",941
"Running Bear, Irving, TX",10022
"Rural-Geneva, Tempe, AZ",6181
"Rusch Park, Citrus Heights, CA",10286
"Ruskin Heights, Kansas City, MO",12091
"Ruskin Hills, Kansas City, MO",15563
"Russell Gardens, Great Neck, NY",13237
"Russell Woods, Detroit, MI",13098
"Russell, Louisville, KY",2989
"Russell, Portland, OR",4257
"Russian Hill, San Francisco, CA",2672
"Russian Jack Park, Anchorage, AK",697
"Russwurm Heights, Nashville, TN",8683
"Rustic Oaks, Garland, TX",7478
"Rustic, Escondido, CA",14616
"Rustlewood Condominium Association, Clearwater, FL",13775
"Ryan Place, Fort Worth, TX",4735
"Ryanvaille, Winston-Salem, NC",13680
"Ryanwood, Fort Worth, TX",3908
"S Y Jackson, Albuquerque, NM",12389
"S. Elm-Hickory, Escondido, CA",14617
"S. Marketview Heights, Rochester, NY",4207
"S.R. Marmon, Albuquerque, NM",12371
"Sabin, Portland, OR",3887
"Sabina-Mattfeldt, Baltimore, MD",7747
"Sable Altura Chambers, Aurora, CO",3171
"SableRidge, Aurora, CO",3864
"Sabre Springs, San Diego, CA",2859
"Sackville, Savannah, GA",14389
"Sacred  Heart, Lowell, MA",9733
"Saddle Ridge, Pleasant Hill, CA",9924
"Saddle Rock Estates, Great Neck, NY",7392
"Saddle Rock Golf Club, Aurora, CO",3351
"Saddle Rock, Great Neck, NY",7036
"Saddleback View, Santa Ana, CA",5809
"Saddlebrook Farms, San Antonio, TX",12323
"Saddlebrook, Nashville, TN",8518
"Saddlebrook, Richardson, TX",8199
"Saddlebrook, Tulsa, OK",7935
"Saddleridge, Nashville, TN",8500
"Sagamore Beach, Bourne, MA",1568
"Sagamore, Bourne, MA",8133
"Sage Creek, Avondale, AZ",10788
"Sage Creek, Fort Collins, CO",10403
"Sagemeadows, Jonesboro, AR",2211
"Sagepointe, Bakersfield, CA",4677
"Sagewood, Greenacres, FL",11174
"Saginaw High, Saginaw, MI",11352
"Saguaro Miraflores, Tucson, AZ",6904
"Saguaro Mountain, Mesa, AZ",8178
"Saguaro Shadows, Mesa, AZ",8458
"Sail Boat Lake Pointe, Oakland Park, FL",9840
"Sailboat Bend, Fort Lauderdale, FL",1575
"Saint Agnes, Baltimore, MD",7150
"Saint Andrews, Columbia, SC",442
"Saint Andrews, Norfolk, VA",9700
"Saint Anne's, Fall River, MA",15420
"Saint Elizabeth Area, Wilmington, DE",14697
"Saint Elizabeths, WA, DC",13139
"Saint Francis Acres, Mountain View, CA",15001
"Saint Helena, Baltimore, MD",7790
"Saint Helens, Longview, WA",9483
"Saint John Cantius, Saint Cloud, MN",14789
"Saint Joseph, Louisville, KY",12162
"Saint Joseph, Milwaukee, WI",3394
"Saint Josephs, Baltimore, MD",1651
"Saint Lawrence-McCallister, Lafayette, IN",2403
"Saint Mary's Orchard, The Woodlands, TX",11047
"Saint Mary's, Lafayette, IN",14387
"Saint Mary's, Long Beach, CA",4485
"Saint Paul, Baltimore, MD",8006
"Saint Stephens-Brockway-Carmen, Saginaw, MI",11357
"Saint Thomas Square, Tulsa, OK",6009
"Saint Vincents Hill Historic District, Vallejo, CA",10173
"Sale Lake, Boulder, CO",13797
"Salem College, Winston-Salem, NC",13437
"Salem Gardens, Winston-Salem, NC",13794
"Salem Village, Columbus, OH",3978
"Salem Woods, Winston-Salem, NC",5827
"Salem, Virginia Beach, VA",167
"Salemtown, Nashville, TN",7247
"Salerno Ranch, Mesa, AZ",7144
"Salina, Dearborn, MI",9402
"Salisbury Oaks, Des Moines, IA",6294
"Salmon Brook, Granby, CT",1650
"Salt Springs, Syracuse, NY",3729
"Salt Springs, Youngstown, OH",13303
"Salt Valley View, Lincoln, NE",8201
"Saltair Hills, Kent, WA",10697
"Saltaire, Town of Islip, NY",13911
"Sam Hughes, Tucson, AZ",1330
"Samarkand, Santa Barbara, CA",5523
"Samish Hill, Bellingham, WA",4527
"Samos, Tucson, AZ",6095
"San Acacio, Santa Fe, NM",1871
"San Anselmo, San Bernardino, CA",6647
"San Antonio Creekside, San Antonio, TX",15564
"San Bernardino International Airport, San Bernardino, CA",5421
"San Carlos, San Diego, CA",2740
"San Carlos, Tucson, AZ",7292
"San Clemente, Tucson, AZ",7029
"San Gabriel Triangle, Albany, CA",14851
"San Gabriel, Albuquerque, NM",13034
"San Gabriel, Tucson, AZ",6222
"San Gorgonio, San Bernardino, CA",3761
"San Ignacio Yaqui, Tucson, AZ",6978
"San Jose Forest, Jacksonville, FL",1732
"San Jose, Albuquerque, NM",15659
"San Jose, Jacksonville, FL",12035
"San Juan, El Paso, TX",15560
"San Marco Island, Miami, FL",8341
"San Marco, Jacksonville, FL",1643
"San Marcos Country Club, Chandler, AZ",5467
"San Marcos, Chandler, AZ",7484
"San Marin, Novato, CA",8725
"San Marino Island, Miami Beach, FL",7950
"San Mateo Heights, San Mateo, CA",3340
"San Mateo Park, San Mateo, CA",4693
"San Mateo Village, San Mateo, CA",3577
"San Mateo, Jacksonville, FL",12669
"San Mateo, Santa Fe, NM",2044
"San Michelle, Mesa, AZ",7516
"San Miguel Ranch, Chula Vista, CA",6288
"San Pablo Gateway, Oakland, CA",4992
"San Pasqual, San Diego, CA",13149
"San Pedro, Los Angeles, CA",66
"San Remo, Sarasota, FL",14359
"San Roque, Santa Barbara, CA",5247
"San Savino, Gilbert, AZ",8274
"San Souci, Tulsa, OK",7830
"San Tan Estates, Gilbert, AZ",7973
"San Tan Ranch, Gilbert, AZ",3385
"San Tomas, Campbell, CA",8827
"San Trope, Bakersfield, CA",5244
"San Vincente, Chandler, AZ",7310
"San Ysidro, San Diego, CA",2544
"Sand Hills, Augusta, GA",12847
"Sand Key Civic Association, Clearwater, FL",1774
"Sand Lake, Anchorage, AK",417
"Sandahl, Tempe, AZ",6501
"Sandalwood, Jacksonville, FL",444
"Sandbridge, Virginia Beach, VA",1810
"Sanders Park, Pompano Beach, FL",13598
"Sandhill-Texas Alley, Covington, GA",10357
"Sandhurst, Charleston, SC",10647
"Sandia Ridge, Albuquerque, NM",13040
"Sandia, Albuquerque, NM",13023
"Sandlewood Estates, Atlanta, GA",8086
"Sandpiper West, Little Rock, AR",8171
"Sandpiper, Little Rock, AR",7663
"Sandpointe, Santa Ana, CA",3916
"Sandtown-Southeastern Atlanta, Atlanta, GA",13851
"Sandtown-Winchester, Baltimore, MD",891
"Sandusky, Birmingham, AL",8793
"Sandy Beach, Fall River, MA",2106
"Sandy Hill, Paterson, NJ",8891
"Sandybrook, Fort Worth, TX",7142
"Sang Valley, Fayetteville, AR",15026
"Sanger Heights, Waco, TX",10151
"Sans Pareil, Jacksonville, FL",12028
"Sans Souci, Jacksonville, FL",12047
"Sans Souci, North Miami, FL",9802
"Santa Ana Triangle, Santa Ana, CA",5059
"Santa Anita, Santa Ana, CA",2757
"Santa Barbara Estates, Pompano Beach, FL",6167
"Santa Barbara Shores, Pompano Beach, FL",12722
"Santa Barbara, Albuquerque, NM",13015
"Santa Clara, Dayton, OH",5708
"Santa Clara, Eugene, OR",3835
"Santa Clara, Hayward, CA",3011
"Santa Cruz Southwest, Tucson, AZ",4678
"Santa Fe Enclave, Fort Worth, TX",7591
"Santa Fe Hills, Kansas City, MO",12665
"Santa Fe Hills, Overland Park, KS",6447
"Santa Fe, Independence, MO",9455
"Santa Fe, Kansas City, MO",15689
"Santa Fe, Oakland, CA",4406
"Santa Fe, Richmond, CA",9196
"Santa Monica Pier Area-Ocean Avenue, Santa Monica, CA",11439
"Santa Nella, Gustine, CA",8828
"Santa Rita Park, Tucson, AZ",6869
"Santa Rita Ranch, Mesa, AZ",5586
"Santa Rita, San Angelo, TX",1931
"Santa Teresa, San Jose, CA",2465
"Santa Venetia, San Rafael, CA",13921
"Santiam, Albany, OR",10506
"Saquish Head, Plymouth, MA",11011
"Sarah's Creek, Pflugerville, TX",11595
"Sarasota Springs, Sarasota, FL",589
"Saratoga Park, Fort Wayne, IN",6487
"Saratoga-East Lynne, Norfolk, VA",9228
"Sardis Forest, Charlotte, NC",1402
"Sardis Woods, Charlotte, NC",3885
"Sarita Heights, Palm Springs, CA",10607
"Sarritt Point, Kansas City, MO",1328
"Saskan Ranch, Flagstaff, AZ",14664
"Saticoy, Ventura, CA",8721
"Satinwood, Corvallis, OR",14799
"Sauer's Gardens, Richmond, VA",6361
"Sauganash Woods, Chicago, IL",8467
"Sauganash, Chicago, IL",1020
"Saugus, Santa Clarita, CA",2524
"Sauk Creek Condominum, Madison, WI",8234
"Sauk Creek, Madison, WI",6107
"Sausal Creek, Oakland, CA",5052
"Savanna Oaks, West Linn, OR",10613
"Savanna, Fayetteville, AR",14253
"Savannah Gardens, Savannah, GA",15343
"Savannah State-Glynnwood-Placentia Place, Savannah, GA",11342
"Savannah Street, Jackson, MS",15640
"Save the Valley 21, El Paso, TX",378
"Saveland Park, Milwaukee, WI",6207
"Savoy of Josey Ranch, Carrollton, TX",10185
"Sawmill Forest, Columbus, OH",5957
"Sawmill Place, Flagstaff, AZ",14669
"Sawmill Ravines, Columbus, OH",6697
"Sawmill, Albuquerque, NM",15703
"Sawtelle, Los Angeles, CA",246
"Saxony, Pflugerville, TX",15435
"Saybrook Manor, Old Saybrook, CT",1802
"Sayler Park, Cincinnati, OH",4615
"Sayles Boulevard, Abilene, TX",2283
"Sayre Street District, Montgomery, AL",15329
"Sayville, Islip, NY",12345
"Sayville, Town of Islip, NY",574
"SBHS, San Bernardino, CA",3160
"SBIC, Baltimore, MD",1577
"Scandia, Poulsbo, WA",7220
"Scarsdale Village, Durham, NC",10045
"Scattered Oaks, San Antonio, TX",7982
"Scenic Bluff, Fort Worth, TX",4361
"Scenic Foothills, Anchorage, AK",854
"Scenic Heights, Arvada, CO",14629
"Scenic Hill, Kent, WA",8873
"Scenic Hill, Semmes, AL",6678
"Scenic Hills, Jonesboro, AR",14694
"Scenic Shores, Fort Worth, TX",8033
"Schenk-Atwood, Madison, WI",4069
"Schenk-Atwood-Starkweather-Yahar, Madison, WI",5254
"Schenley, Youngstown, OH",1313
"Schiller Park, Buffalo, NY",2864
"Schirm Farm, Columbus, OH",5492
"Schmitt Park, Green Bay, WI",11488
"Schnitzelburg, Louisville, KY",3890
"Scholl Canyon, Glendale, CA",13358
"School, Oakland, CA",5299
"Schorsch Forest View, Chicago, IL",7884
"Schorsch Village, Chicago, IL",1004
"Schumacher Place, Columbus, OH",5886
"Schwettman Oaks, New Port Richey, FL",6001
"Scioto Trace, Columbus, OH",4572
"Scioto Woods, Columbus, OH",4083
"Scoth Pines, Fort Collins, CO",14745
"Scotlandville, Baton Rouge, LA",12910
"Scott Highlands, Apple Valley, MN",10923
"Scott Lake, Miami Gardens, FL",13987
"Scott Park, Toledo, OH",712
"Scott Road, Waterbury, CT",10828
"Scott Valley, Mill Valley, CA",15184
"Scott's Addition, Richmond, VA",7198
"Scotts Crossing, Atlanta, GA",13298
"Scottsboro, Nashville, TN",5855
"Scottsdale Community, South Bend, IN",12750
"Scottsdale, Chicago, IL",2679
"Scripps Ranch, San Diego, CA",424
"Scudder Park West, Tempe, AZ",6187
"SE Heights, Albuquerque, NM",12391
"SE Redmond, Redmond, WA",3780
"Sea Air, Oxnard, CA",10573
"Sea Cliff, San Francisco, CA",6293
"Sea Pines, Hilton Head Island, SC",1988
"Sea View Estates, Oxnard, CA",10552
"Seaboard Industrial, Orlando, FL",13183
"Seabold, Bainbridge Island, WA",9298
"Seahurst, Burien, WA",8754
"Sears Park, Abilene, TX",10777
"Seaside, Torrance, CA",3691
"Seatack, Virginia Beach, VA",530
"Seaview, Pacific Grove, CA",14210
"Seaview, Seattle, WA",4041
"Seberger-Roosevelt, Saint Cloud, MN",2226
"Sebille Manor, Chesterfield, MI",14072
"Seccombe Lane, San Bernardino, CA",3906
"Secluded Valley, Lafayette, CA",15175
"Second Addition, Pacific Grove, CA",15259
"Second Avenue, Albany, NY",6267
"Second Creek, Mobile, AL",1459
"Second Ward, Houston, TX",11888
"Secret Cove, Jacksonville, FL",1227
"Sedamsville, Cincinnati, OH",7264
"Sedge Brook Hills, Winston-Salem, NC",7342
"Sedge Lake Garden, Winston-Salem, NC",7934
"Sedgefield, Charlotte, NC",4547
"Sedgemont, Winston-Salem, NC",8305
"Sedgewick, Syracuse, NY",15570
"Sedgwick, Syracuse, NY",1673
"Sehome, Bellingham, WA",4144
"Self Help Neighborhood Council, Kansas City, MO",12836
"Sellwood-Moreland, Portland, OR",2846
"Seminary Hill, Alexandria, VA",405
"Seminary Ridge, Columbia, SC",6893
"Seminary, Oakland, CA",3621
"Seminole Heights, Tampa, FL",11849
"Seminole, Eight Mile, AL",7449
"Seminole-Holland, Springfield, MO",11300
"Senda Nueva, Davis, CA",6013
"Sendera Ranch, Fort Worth, TX",4225
"Sendero Springs, Round Rock, TX",15319
"Seneca, Buffalo, NY",4538
"Seneca, Moreno Valley, CA",9492
"Senter, Irving, TX",10020
"Seola Beach, Burien, WA",14211
"Sequoia Park, Denton, TX",11415
"Sequoia, Redwood City, CA",15408
"Sequoyah, Oakland, CA",3951
"Sequoyah, Tulsa, OK",1349
"Serano, Moreno Valley, CA",10545
"Serra Mesa, San Diego, CA",2557
"Serra, Sunnyvale, CA",2700
"Serra, Ventura, CA",11726
"Serrano, Gilbert, AZ",7078
"Servite Woods, Milwaukee, WI",6325
"Sessom Creek, San Marcos, TX",10745
"Seton Business Park, Baltimore, MD",13569
"Seton Hill, Baltimore, MD",5634
"Seton Village, South Orange, NJ",9019
"Settegast, Houston, TX",12533
"Settler's Crossing, Gilbert, AZ",7695
"Settler's Meadow, Gilbert, AZ",6669
"Settler's Point South, Gilbert, AZ",6729
"Settler's Point, Gilbert, AZ",7324
"Settlers Landing, Jacksonville, FL",11913
"Settlers Meadow, Pflugerville, TX",11593
"Settlers Ridge, Pflugerville, TX",15442
"Seven Bar North, Albuquerque, NM",12409
"Seven Eagles, Charlotte, NC",4466
"Seven Hills, Aurora, CO",3380
"Seven Hills, Owensboro, KY",14115
"Seven Isles, Fort Lauderdale, FL",1771
"Seven Oaks, Bakersfield, CA",1461
"Seven Oaks, Columbia, SC",729
"Seven Oaks, Columbus, OH",6913
"Seven Springs, Greenacres, FL",8991
"Seven Springs, Nashville, TN",8371
"Seventh Avenue, Newark, NJ",746
"Seventh Ward, New Orleans, LA",12348
"Seversville, Charlotte, NC",6585
"Seville Condo No.11, Clearwater, FL",13670
"Seville Condominium No.7 Association, Clearwater, FL",13869
"Seville Condominium, Clearwater, FL",13805
"Seville, Gilbert, AZ",1216
"Seward Hall, Franklin, TN",788
"Seward Park, Seattle, WA",5017
"Seward, Minneapolis, MN",3207
"Sewaren, Woodbridge Township, NJ",5859
"Sewell, Tucson, AZ",6166
"Sewells Gardens, Norfolk, VA",9247
"Sexton Mountain, Beaverton, OR",3074
"Sexton Woods, Brookhaven, GA",15225
"Seymour Park, Green Bay, WI",2370
"Shadow Hawk, Renton, WA",7168
"Shadow Hills, Los Angeles, CA",1381
"Shadow Hills, Lubbock, TX",8829
"Shadow Mountain, Arvada, CO",10213
"Shadow Mountain, Flagstaff, AZ",10308
"Shadow Mountain, Tulsa, OK",6158
"Shadow Ridge, Tulsa, OK",7909
"Shadow Run, Santa Ana, CA",5869
"Shadow Valley, Ogden, UT",2380
"Shadowmoss, Charleston, SC",9148
"Shadowood, Johnson City, TN",10816
"Shady Banks, Fort Lauderdale, FL",1757
"Shady Canyon, Irvine, CA",1781
"Shady Grove, Irving, TX",9197
"Shady Lane, Columbus, OH",3555
"Shady Ln, Danville, IL",14493
"Shady Oak Farms Homeowners Association, Clearwater, FL",13764
"Shady Oak, Lansing, MI",11411
"Shady Oaks, San Antonio, TX",15557
"Shadyside, Pittsburgh, PA",2705
"Shadywood East, Norfolk, VA",15300
"Shafter, Oakland, CA",4125
"Shaheen Estates, Tucson, AZ",7374
"Shalimar, Tempe, AZ",6685
"Shalimar, Winston-Salem, NC",8068
"Shallow Creek, Pflugerville, TX",11582
"Shamrock Estates, Gilbert, AZ",5870
"Shamrock Heights, Renton, WA",7871
"Shanahan Ridge, Boulder, CO",6262
"Shandin Hills, San Bernardino, CA",3551
"Shandon, Columbia, SC",1348
"Shanklin Millrace, Goshen, IN",10929
"Shannon Green, Columbus, OH",3789
"Shannon Heights, Columbus, OH",7636
"Shannon Hills, Pleasant Hill, CA",13953
"Shannon Park, Charlotte, NC",3201
"Shannon Park, Tulsa, OK",6059
"Shannon Place, Nashville, TN",8614
"Shark River Hills, Neptune, NJ",1715
"Sharon Heights, Columbus, OH",1265
"Sharon Heights, Menlo Park, CA",4022
"Sharon Heights, Tulsa, OK",7751
"Sharon Line-Mcguffey Heights, Youngstown, OH",5086
"Sharon Park, Orem, UT",10321
"Sharon Woods, Charlotte, NC",3964
"Sharon, Orem, UT",9600
"Sharp Estates, Richardson, TX",13746
"Sharp's Farm, Richardson, TX",8156
"Sharp-Leadenhall, Baltimore, MD",6099
"Sharpstown, Houston, TX",64
"Sharswood, Philadelphia, PA",9772
"Shattalon Heights, Winston-Salem, NC",13792
"Shattalon Lake Estates, Winston-Salem, NC",7018
"Shaw Clarke, Fort Worth, TX",6355
"Shaw, Saint Louis, MO",1047
"Shaw, WA, DC",2869
"Shawnee Heights, Kansas City, KS",11242
"Shawnee Hills, Chattanooga, TN",9051
"Shawnee Park, Chandler, AZ",6747
"Shawnee Pioneers-Douglas Highlands, Shawnee, KS",14793
"Shawnee Village, Shawnee, KS",10439
"Shawnee, Louisville, KY",749
"Shea Terrace, Portsmouth, VA",2023
"Shearer Hills - Ridgeview, San Antonio, TX",15664
"Shearwater, Redwood City, CA",15411
"Sheely Addtions, Fort Collins, CO",10381
"Sheep Mountain, Las Vegas, NV",423
"Sheepshead Bay, NY, NY",60
"Sheffield Neighbors, Chicago, IL",767
"Sheffield on the Harpeth, Nashville, TN",7953
"Sheffield Village, Oakland, CA",7651
"Sheffield, Jackson, MS",1789
"Sheffield, Kansas City, MO",12968
"Shelard Park, Saint Louis Park, MN",10483
"Shelby Forest-Frayser, Memphis, TN",224
"Shelby Hills, Nashville, TN",5838
"Shelby Park, Louisville, KY",12160
"Sheldon, Mobile, AL",3991
"Sheldon-Charter Oak, Hartford, CT",4375
"Shelltown, San Diego, CA",3863
"Shelter Cove, Hilton Head Island, SC",9149
"Shelter Cove, Whitethorn, CA",8692
"Shenandoah West, Roanoke, VA",10659
"Shenandoah, Aurora, CO",6993
"Shenandoah, Baton Rouge, LA",1916
"Shenandoah, Fort Collins, CO",14296
"Shenandoah, Miami, FL",703
"Shenorock, Somers, NY",5462
"Shepard Boulevard, Columbia, MO",10758
"Shepard Street, Lansing, MI",11405
"Shepard, Columbus, OH",6644
"Shephardwood, Nashville, TN",7454
"Shepherd Canyon, Oakland, CA",5265
"Shepherd Hills, Nashville, TN",7462
"Shepherd Park, WA, DC",4539
"Sheraden, Pittsburgh, PA",1278
"Sheraton Lawns, Wauwatosa, WI",14847
"Sheridan Drive, Durham, NC",14531
"Sheridan Gardens, Des Moines, IA",1138
"Sheridan Heights, Tulsa, OK",13691
"Sheridan Hills South, Tulsa, OK",7420
"Sheridan Hollow, Albany, NY",5858
"Sheridan Park, Chicago, IL",3310
"Sheridan South, Tulsa, OK",7880
"Sheridan Triangle, Madison, WI",7423
"Sheridan, Minneapolis, MN",4742
"Sherman Acres, Pleasant Hill, CA",9921
"Sherman Heights, San Diego, CA",4499
"Sherman Hill, Des Moines, IA",5584
"Sherman Hills, Stuart, FL",15149
"Sherman Oaks, Los Angeles, CA",5
"Sherman Park, Milwaukee, WI",1058
"Sherman Terrace Condominum, Madison, WI",7797
"Sherman Village, Madison, WI",4936
"Sherman, Madison, WI",4876
"Sherril Park North And Foxboro Addition, Richardson, TX",7513
"Sherwood Forest, Atlanta, GA",13487
"Sherwood Forest, Baton Rouge, LA",1922
"Sherwood Forest, Charlotte, NC",4180
"Sherwood Forest, Columbia, SC",7077
"Sherwood Forest, Detroit, MI",13262
"Sherwood Forest, Jacksonville, FL",12473
"Sherwood Forest, Mesquite, TX",10202
"Sherwood Forest, Nashville, TN",6639
"Sherwood Forest, Norfolk, VA",11203
"Sherwood Forest, San Francisco, CA",6634
"Sherwood Glen, Wichita, KS",12755
"Sherwood Hills, Provo, UT",10619
"Sherwood Manor, Mesa, AZ",7103
"Sherwood Oaks, Bloomington, IN",14940
"Sherwood Park, Huntsville, AL",8794
"Sherwood Park, Richmond, VA",6473
"Sherwood to Pettit, Fort Wayne, IN",6742
"Sherwood, Mesa, AZ",5971
"Sherwood, Springfield, MO",9363
"Sherwood-Audubon Area, Jackson, MS",12855
"Sheveland Ranch, Napa, CA",11446
"Shields-Reid, Richmond, CA",11529
"Shifley-York, Owensboro, KY",10374
"Shiloh, Morrisville, NC",9248
"Shimek, Iowa City, IA",10367
"Shingle Creek, Brooklyn Park, MN",11617
"Shingle Creek, Minneapolis, MN",4376
"Shipley Hill, Baltimore, MD",5219
"Shipley Terrace, WA, DC",2930
"Shipoke, Harrisburg, PA",2169
"Shippan, Stamford, CT",1390
"Shipyard, Hilton Head Island, SC",9150
"Shirrells, San Bernardino, CA",4306
"Shockoe Bottom, Richmond, VA",11990
"Shore Acres, Lakeland, FL",13260
"Shore Acres, NY, NY",6720
"Shore Acres, Saint Petersburg, FL",1385
"Shorefront Park, Norwalk, CT",14964
"Shoreline West, Mountain View, CA",15003
"Shores of Eastern Hills, Garland, TX",7868
"Shores of Rock Creek, Fort Wayne, IN",6907
"Shorewood, Burien, WA",8733
"Shorewood, Fort Wayne, IN",12312
"Short Street, Covington, GA",14699
"Show Place, San Bernardino, CA",5678
"Shroyer Park, Dayton, OH",4519
"Shrub Oak, Yorktown, NY",4906
"Shumway, Vancouver, WA",6271
"Shurtleff, Napa, CA",11448
"Si View, North Bend, WA",10583
"Side Creek, Aurora, CO",3568
"Side Hill, Fort Collins, CO",14734
"Sidestown-Shankletown, Concord, NC",10680
"Sienna Heights, Chandler, AZ",8100
"Sierra Circle, San Marcos, TX",15055
"Sierra del Oro, Corona, CA",2982
"Sierra Estates, Mesa, AZ",8393
"Sierra Estates, Tucson, AZ",7688
"Sierra Gardens, Roseville, CA",4254
"Sierra Heights, Mesa, AZ",8343
"Sierra Linda, Oxnard, CA",10578
"Sierra Oaks, Sacramento, CA",5241
"Sierra Ranch, Mesa, AZ",6476
"Sierra Ridge, Parker, CO",14959
"Sierra Springs, Gilbert, AZ",8099
"Sierra Springs, San Antonio, TX",12511
"Sierra Vista, Arvada, CO",8807
"Sierra Vista, Parker, CO",14960
"Sierra Vista, Roseville, CA",5890
"Signal Butte Manor, Mesa, AZ",7699
"Signal Butte Ranch, Mesa, AZ",9725
"Signal Hill, Orlando, FL",12233
"Silk Stocking, Chandler, AZ",6896
"Silo Ridge, Pittsfield Township, MI",15202
"Silver Chase, Tulsa, OK",7768
"Silver City, Milwaukee, WI",3777
"Silver Creek, Bakersfield, CA",3539
"Silver Creek, Gilbert, AZ",8564
"Silver Creek, North Bend, WA",9656
"Silver Dell, Moreno Valley, CA",11048
"Silver Hill, Albuquerque, NM",12944
"Silver Hill-Magnolia, Charleston, SC",14946
"Silver Lake, Everett, WA",3083
"Silver Lake, Los Angeles, CA",207
"Silver Lake, NY, NY",5187
"Silver Lake, Wilmington, NC",1016
"Silver Oaks, Fort Collins, CO",14750
"Silver Plume, Fort Collins, CO",8837
"Silver Ridge, Berkeley, NJ",5904
"Silver Ridge, Fort Worth, TX",8275
"Silver Spring, Milwaukee, WI",2787
"Silver Springs, Lafayette, CA",14108
"Silver Sprints Village, El Paso, TX",1710
"Silver Strand, Oxnard, CA",8830
"Silver Swan, Milwaukee, WI",4468
"Silver Terrace, San Francisco, CA",2996
"Silverbell Terrace, Tucson, AZ",8508
"Silverbrook, San Antonio, TX",15600
"Silvercroft, Tucson, AZ",7438
"Silverhawke, Gilbert, AZ",5345
"Silverlake, Providence, RI",674
"Silverleaf, Ypsilanti, MI",9630
"Silvermine, Wilton, CT",8849
"Silverstone Ranch, Gilbert, AZ",7470
"Silverwood, Charlotte, NC",6278
"Silverwood, Plano, TX",8951
"Simonsdale, Portsmouth, VA",2024
"Sims Grant, New Port Richey, FL",7216
"Singer Island, Riviera Beach, FL",11873
"Singing Arrow, Albuquerque, NM",12369
"Singletree, Aurora, CO",8546
"Six Forks, Raleigh, NC",794
"Six Points, West Allis, WI",15042
"Sixteen Acres, Springfield, MA",395
"Sixteenth Street Heights, WA, DC",2693
"Skies West, Albuquerque, NM",12569
"Skinker-DeBaliviere, Saint Louis, MO",3760
"Skunk City, Syracuse, NY",4819
"Sky Hy, Orem, UT",15178
"Sky Park, Muncie, IN",11556
"Skylake, North Miami Beach, FL",10599
"Skyland Park, Mobile, AL",4296
"Skyland Terrace-Greenway Park-Grove Park, Savannah, GA",2345
"Skyland, Brookhaven, GA",14102
"Skyland, Columbia, SC",5703
"Skyland, Denver, CO",4358
"Skyland, WA, DC",4713
"Skyland, Winston-Salem, NC",6072
"Skylands, Lake Oswego, OR",13497
"Skyline - Hillcrest Estates, Oakland, CA",6136
"Skyline Acres, Fort Collins, CO",14751
"Skyline Forest, Monterey, CA",10475
"Skyline MHP, Fort Collins, CO",14730
"Skyline Park, San Antonio, TX",13058
"Skyline Ridge, Monterey, CA",10007
"Skyline Ridge, Tulsa, OK",13360
"Skyline Village, Mesa, AZ",6783
"Skyline Village, Nashville, TN",8684
"Skyline Village, Winston-Salem, NC",7571
"Skyline, Arvada, CO",14318
"Skyline, San Diego, CA",2921
"Skytop-South Campus, Syracuse, NY",13099
"Skyview Meadows, Madison, WI",7075
"Skyview Terrace, Madison, WI",13715
"Skyview, Nashville, TN",6965
"Skyway, Miami Gardens, FL",9299
"Slab Town, Traverse City, MI",11788
"Slate Hill, Columbus, OH",4830
"Slater Park, Winston-Salem, NC",6868
"Slater Rd-Hamilton Circle, Charlotte, NC",4505
"Slater, Mountain View, CA",9433
"Slaton-Bean, Lubbock, TX",11214
"Slatterly Park, Rochester, MN",11386
"Sleepy Hollow, Chicago, IL",6463
"Sleepy River, Oakland Park, FL",14436
"Slide Hill Park, Davis, CA",6123
"Sloan Lake, Denver, CO",3165
"Sloatsburg, Ramapo, NY",1550
"Smallwood, Charlotte, NC",5893
"SMB Estates, Livonia, MI",10248
"Smiley Heights, Baton Rouge, LA",13059
"Smith Hill, Providence, RI",3546
"Smith Mills, Dartmouth, MA",1375
"Smith Ranch, San Rafael, CA",15473
"Smith Springs Townhomes, Nashville, TN",8695
"Smithfield Estates, Birmingham, AL",11243
"Smithfield, Birmingham, AL",8795
"Smithton Ridge, Columbia, MO",14985
"Smithville, Duluth, MN",8965
"Smoke Tree Ranch, Gilbert, AZ",7720
"Smokerise Valley, Flagstaff, AZ",10313
"Smoketown Jackson, Louisville, KY",12655
"Smokey Hollow, Youngstown, OH",13536
"Smokey Point Manufacturing-Industrial Center, Arlington, WA",11780
"Smokey Ridge Estates, Columbus, OH",5788
"Snacks-Guion Creek, Indianapolis, IN",2133
"Snell Isle, Saint Petersburg, FL",1590
"Snow Heights, Albuquerque, NM",13005
"Snow Woods, Dearborn, MI",11468
"Snowball Gate, Levittown, PA",10916
"Snowhill, Conway, SC",9477
"Snug Harbor, Pompano Beach, FL",1542
"Snyder, Amherst, NY",8764
"Sobrante Park, Oakland, CA",4378
"Social District, Woonsocket, RI",14146
"Society Hill, Philadelphia, PA",1989
