AREA,CODE
"Fairfax, Jacksonville, FL",1709
"Fairfax, Oakland, CA",5088
"Fairfield Acres-Bissett, Springfield, MO",11296
"Fairfield Area, Baltimore, MD",7316
"Fairfield Terrace-Belmont, Fort Wayne, IN",5964
"Fairfield Village, Flint, MI",10191
"Fairfield, Durham, NC",9510
"Fairfield, Fort Wayne, IN",13026
"Fairfield, Jacksonville, FL",12853
"Fairfield, Milwaukee, WI",4708
"Fairfield, Richmond, VA",6235
"Fairfields, Baton Rouge, LA",9747
"Fairground Neighborhood, Saint Louis, MO",5680
"Fairground, Des Moines, IA",1272
"Fairgrounds, Columbus, OH",13186
"Fairgrounds, Fredericksburg, VA",9616
"Fairgrounds, Indianapolis, IN",2099
"Fairgrounds, Louisville, KY",13470
"Fairgrounds, New Orleans, LA",3498
"Fairgrounds, Sacramento, CA",7337
"Fairgrounds, San Jose, CA",135
"Fairgrounds, Tucson, AZ",5091
"Fairhaven, Bellingham, WA",7708
"Fairhaven, Fort Worth, TX",6516
"Fairhaven, Santa Ana, CA",4821
"Fairhill, Philadelphia, PA",2537
"Fairhills, San Rafael, CA",15480
"Fairland Heights, Independence, MO",11308
"Fairlane Park, Nashville, TN",7494
"Fairlane, Dayton, OH",6078
"Fairlane, Kansas City, MO",12060
"Fairlawn Heights, Akron, OH",4812
"Fairlawn, Kokomo, IN",14290
"Fairlawn, Pawtucket, RI",1979
"Fairlawn, WA, DC",4687
"Fairlawn, Waterbury, CT",8843
"Fairlington-Bradlee, Alexandria, VA",6906
"Fairlington-Shirlington, Arlington, VA",2881
"Fairmeadow, Palo Alto, CA",5588
"Fairmont Park, Des Moines, IA",1343
"Fairmont, Baltimore, MD",7814
"Fairmont, Birmingham, AL",9578
"Fairmont, Fort Wayne, IN",7020
"Fairmount Park, Norfolk, VA",2010
"Fairmount Park, San Diego, CA",4304
"Fairmount Park, Seattle, WA",3590
"Fairmount Village, San Diego, CA",3366
"Fairmount, Canton, OH",9079
"Fairmount, Duluth, MN",9078
"Fairmount, Eugene, OR",4007
"Fairmount, Fort Worth, TX",4150
"Fairmount, Philadelphia, PA",388
"Fairmount, Richmond, VA",6372
"Fairmount, Waterbury, CT",8844
"Fairmount, Wichita, KS",15651
"Fairmount, Woonsocket, RI",9161
"Fairmuont, Newark, NJ",696
"Fairoaks, Tampa, FL",12090
"Fairpark, Salt Lake City, UT",12467
"Fairport, Perinton, NY",1260
"Fairview Meadows, Chandler, AZ",8035
"Fairview Park, Oakland, CA",3998
"Fairview, Allentown, PA",9487
"Fairview, Altoona, PA",1966
"Fairview, Anchorage, AK",11909
"Fairview, Birmingham, AL",9651
"Fairview, Camden, NJ",1940
"Fairview, Dayton, OH",5582
"Fairview, Fredericksburg, VA",9675
"Fairview, Hayward, CA",2805
"Fairview, Lansing, MI",9517
"Fairview, Milwaukee, WI",4097
"Fairview, Olathe, KS",9617
"Fairview, Red Bank, NJ",1767
"Fairway 164th, Vancouver, WA",4880
"Fairway Acres, Atlanta, GA",7902
"Fairway Bend, Fort Worth, TX",4556
"Fairway Estates, Mesa, AZ",7974
"Fairway Gardens Townhouses, Mesa, AZ",8333
"Fairway Oaks, Bakersfield, CA",5808
"Fairway Oaks, Savannah, GA",13994
"Fairway Park, Hayward, CA",2978
"Fairway View, Nashville, TN",8531
"Fairway Vista, Carrollton, TX",10177
"Fairway, New Smyrna Beach, FL",8876
"Fairway-Liberty Heights, Lexington, KY",1170
"Fairways Forest, Jacksonville, FL",12165
"Fairways of Blackhawk, Pflugerville, TX",11577
"Fairways of Sherril Park, Richardson, TX",7609
"Fairwold Acres, Columbia, SC",7262
"Fairwood and Robandee, Kansas City, MO",12117
"Fairwood, Baton Rouge, LA",9275
"Fairywood, Pittsburgh, PA",6171
"Falcon Hill, Fort Collins, CO",14813
"Falcon Hill, Mesa, AZ",7658
"Falcon Pointe, Pflugerville, TX",11576
"Falcon Ridge, Fort Worth, TX",4757
"Falcon Ridge, Renton, WA",8553
"Falcon, Colorado Springs, CO",807
"Fall Creek Estates, Garland, TX",7701
"Fall Creek, Fort Wayne, IN",8672
"Fall Creek, Indianapolis, IN",2093
"Fallbrook, Elk Grove, CA",13959
"Fallon, Roanoke, VA",9435
"Falls of Beaver Creek, Fort Wayne, IN",7923
"Falls of Neuse, Raleigh, NC",3055
"Fallsgrove, Rockville, MD",10505
"Fallstaff, Baltimore, MD",3771
"Family Acres, Lincoln, NE",3150
"Famous Ships, Foster City, CA",9999
"Far East, Fort Worth, TX",6986
"Far Eastside, Indianapolis, IN",2148
"Far Greater Northside, Fort Worth, TX",2729
"Far Horizions, Arvada, CO",10232
"Far North, Dallas, TX",18
"Far Rockaway, NY, NY",75
"Far South, Lincoln, NE",8137
"Far Southside, Abilene, TX",2291
"Far Southwest, Fort Worth, TX",3689
"Far Southwest, Portland, OR",5554
"Far West, Eugene, OR",4048
"Far West-Side, Syracuse, NY",3247
"Farm Hill, Redwood City, CA",15412
"Farm Pond, Charlotte, NC",3475
"Farm Road, Marlborough, MA",10529
"Farmbrook, Levittown, PA",9081
"Farmers Bridge, Augusta, GA",13233
"Farmers Market District, Dallas, TX",5950
"Farmhouse Meadows, Gilbert, AZ",6981
"Farmingham Road, Marlborough, MA",14902
"Farmingham Woods, Nashville, TN",8270
"Farms I, Chelmsford, MA",11099
"Farms II, Chelmsford, MA",11102
"Farmview-Ramble, Blacksburg, VA",15107
"Farview, Independence, MO",11425
"Farview, Nashville, TN",8361
"Farviews & Pattee Canyon, Missoula, MT",12651
"Farville, Jonesboro, AR",14679
"Father Blanchet Park, Vancouver, WA",6400
"Father Kelly, Fall River, MA",11543
"Faulkner, Malden, MA",8902
"Faulkner, New Smyrna Beach, FL",8930
"Fauntleroy, Seattle, WA",3824
"Fawnbrook, Richmond, VA",6979
"Faye Wright, Salem, OR",857
"Federal Hill, Baltimore, MD",1603
"Federal Hill, Providence, RI",994
"Federal Street, Salem, MA",9912
"Feiler Park-Hussars Terrace-Dittmerville, Savannah, GA",11336
"Feldheym, San Bernardino, CA",3913
"Feldman's, Tucson, AZ",4968
"Fells Point, Baltimore, MD",1384
"Felton Gables, Menlo Park, CA",13528
"Feltonville, Philadelphia, PA",1967
"Felty Farms, Gilbert, AZ",7919
"Fenelon-Hill, Dubuque, IA",11667
"Fenway, Boston, MA",2559
"Fenwick, Old Saybrook, CT",8252
"Ferger Place, Chattanooga, TN",11638
"Fern Bluff, Round Rock, TX",11250
"Fern Creek, Louisville, KY",497
"Fern Hill, Saint Louis Park, MN",9884
"Fern Rock, Philadelphia, PA",9082
"Ferncrest, Bartlett, TN",14419
"Fernleaf, Atlanta, GA",13599
"Fernside, Alameda, CA",11649
"Fernway, Shaker Heights, OH",10011
"Fernwood United Neighbors, Garland, TX",7370
"Fernwood, Chicago, IL",824
"Fernwood, Milwaukee, WI",4726
"Fernwood-Parkwood, Savannah, GA",11341
"Ferry, Mobile, AL",6039
"Ferryway, Malden, MA",10848
"Fiarlawn, San Marcos, TX",15050
"Fiddyment Farm, Roseville, CA",6789
"Field, Minneapolis, MN",4745
"Fieldcrest, Avondale, AZ",10785
"Fields of Brick Church, Nashville, TN",8579
"Fieldston, NY, NY",3950
"Fieldstone by the Eno, Durham, NC",10066
"Fieldstone, Tulsa, OK",13608
"Fiesta Gardens, San Mateo, CA",5548
"Fiesta Park Village, Mesa, AZ",4818
"Fiesta, Mesa, AZ",6509
"Fiesta, Santa Fe, NM",10635
"Fifeville, Charlottesville, VA",12212
"Fifth Addition, Pacific Grove, CA",11153
"Fifth Avenue, Gainesville, FL",10133
"Fifth City, Chicago, IL",4891
"Fifth Ward, Newport, RI",1910
"Fillmore, New Orleans, LA",1203
"Film Row, Fort Collins, CO",15244
"Financial District, NY, NY",2528
"Financial District, San Francisco, CA",4220
"Fincher Farms, Gilbert, AZ",8126
"Fine View, Pittsburgh, PA",6091
"Finley Farms, Gilbert, AZ",4176
"Finn Hill, Kirkland, WA",2835
"Fircrest, Vancouver, WA",3342
"Fire Tower, Semmes, AL",7145
"Firemans Park, Green Bay, WI",15394
"Firestone Park, Akron, OH",578
"Firestone-Garden Park, Charlotte, NC",6062
"Firewheel Estates, Garland, TX",7119
"Firewheel Farms, Garland, TX",8000
"First Addition, Pacific Grove, CA",15238
"First Addition-Forest Hills, Lake Oswego, OR",5171
"First Centerville, Garland, TX",7287
"First Hill, Seattle, WA",2806
"First Landing State Park, Virginia Beach, VA",13207
"First Place, Vancouver, WA",6112
"First Ward, Buffalo, NY",5437
"First Ward, Charlotte, NC",5108
"First Ward, Morgantown, WV",2188
"Firthcliffe, Cornwall, NY",1377
"Fischer Dev, New Orleans, LA",13257
"Fish, Foster City, CA",10000
"Fisher Hill, Brookline, MA",14894
"Fisher Park, Greensboro, NC",14085
"Fisher Park, Santa Ana, CA",6018
"Fisher Woods, Wauwatosa, WI",10464
"Fisher, Mobile, AL",5092
"Fisherman Flats, Monterey, CA",14516
"Fishermans Landing, Plymouth, MA",14046
"Fishers Creek, Vancouver, WA",6255
"Fishers Landing East, Vancouver, WA",3450
"Fishkorn, Detroit, MI",13094
"Fishtown, Philadelphia, PA",568
"Fisk - Meharry, Nashville, TN",4686
"Fisk Addition, Green Bay, WI",2368
"Fitchburg, Oakland, CA",5538
"Fitler Square, Philadelphia, PA",12921
"Fitzgerald, Detroit, MI",1074
"Fitzsimons, Aurora, CO",13291
"Five Corners, Burien, WA",9276
"Five Mile Creek, Dallas, TX",3388
"Five Mile-Prairie, Spokane, WA",1660
"Five Oaks - Triple Creek, Beaverton, OR",2573
"Five Oaks Condos, Nashville, TN",8430
"Five Oaks, Dayton, OH",4521
"Five Oaks, Durham, NC",9730
"Five Parks, Arvada, CO",10226
"Five Points Northeast, Oxnard, CA",14913
"Five Points South, Birmingham, AL",1859
"Five Points, Dayton, OH",6856
"Five Points, Denver, CO",661
"Five Points, Detroit, MI",12625
"Five Points, El Paso, TX",739
"Five Points, Fort Wayne, IN",5917
"Five Points, Indianapolis, IN",11956
"Five Points, Montgomery, AL",14159
"Five Points, Raleigh, NC",3065
"Five Points, Saint Petersburg, FL",6818
"Five Points, Toledo, OH",422
"FL, New Orleans, LA",13241
"Flagami, Miami, FL",11806
"Flagler Heights, Fort Lauderdale, FL",12382
"Flagstaff Brannen Addtion, Flagstaff, AZ",14668
"Flagstaff Ranch, Flagstaff, AZ",10290
"Flagstaff Townsite, Flagstaff, AZ",14670
"Flamingo Lummus, Miami Beach, FL",357
"Flamingo Park, Fort Lauderdale, FL",12766
"Flamingo Park, West Palm Beach, FL",13180
"Flat Rock, Winston-Salem, NC",6493
"Flatbush, NY, NY",24
"Flatiron District, NY, NY",303
"Flatiron District, Oklahoma City, OK",15247
"Flatirons, Boulder, CO",5727
"Flatlands, NY, NY",94
"Flats, Wilmington, DE",8999
"Flax Hill, Norwalk, CT",10703
"Fleetwood, Nashville, TN",8309
"Fletcher Bay, Bainbridge Island, WA",9277
"Fleury, Prescott, AZ",15075
"Flint Road, Columbus, OH",6718
"Flint, Fall River, MA",9417
"Flintridge Village, Ladera Ranch, CA",9906
"Floral park, NY, NY",671
"Floral Park, Santa Ana, CA",5157
"Floreciente, Moline, IL",9878
"Florence Park South, Tulsa, OK",7175
"Florence Park, Tulsa, OK",5626
"Florence, Tampa, FL",13394
"Floresta Gardens, San Leandro, CA",10726
"Florida Center North, Orlando, FL",11841
"Florida Center, Orlando, FL",12069
"Florida Heights, Atlanta, GA",12319
"Florida Memorial University, Miami Gardens, FL",10263
"Florin Fruitridge Industrial Park, Sacramento, CA",13637
"Florist Highlands, Milwaukee, WI",6125
"Flour Bluff, Corpus Christi, TX",11819
"Flower Park, Santa Ana, CA",3149
"Flowing Wells, Tucson, AZ",2697
"Flushing Meadows Corona Park, NY, NY",13214
"Flushing, NY, NY",2440
"Flying Horse, Colorado Springs, CO",1641
"FNW, South Bend, IN",15700
"Fodor, Columbus, OH",5942
"Foggy Bottom, WA, DC",2744
"Folkstone, San Rafael, CA",14545
"Folsom Road, Roseville, CA",4457
"Folwell, Minneapolis, MN",1173
"Folwell, Rochester, MN",11389
"Fond du Lac, Duluth, MN",14077
"Fondern-Cherokee Heights, Jackson, MS",13019
"Fondren North, Jackson, MS",1448
"Foothill Boulevard Corridor, La Verne, CA",10474
"Foothill Farms, Sacramento, CA",2609
"Foothill Square, Oakland, CA",5803
"Foothill Terrace, San Mateo, CA",5866
"Foothill, Santa Barbara, CA",7450
"Foothills Green, Fort Collins, CO",14740
"Foothills Junction, Roseville, CA",3770
"Foothills Park, Fort Collins, CO",10394
"Foothills, Henderson, NV",1162
"Foothills, Lake Oswego, OR",13398
"Foothills, Provo, UT",10743
"Ford City, Chicago, IL",6092
"Ford Historic District, Dearborn, MI",15391
"Ford Woods, Dearborn, MI",11461
"Fordham, NY, NY",2469
"Fords, Woodbridge Township, NJ",682
"Fordson, Dearborn, MI",11460
"Forest Acres Estates, Nashville, TN",7285
"Forest Beach, Hilton Head Island, SC",9144
"Forest Cove Homeowners, Nashville, TN",8138
"Forest Cove, Agoura Hills, CA",9902
"Forest Creek, Tulsa, OK",6860
"Forest Crest, Garland, TX",6983
"Forest Crest, San Antonio, TX",6382
"Forest Dale, Flagstaff, AZ",14144
"Forest Glen, Arlington, VA",7090
"Forest Glen, Boulder, CO",13613
"Forest Glen, Chicago, IL",12833
"Forest Heights, Baton Rouge, LA",8931
"Forest Highland, Mobile, AL",6575
"Forest Highlands, Flagstaff, AZ",14667
"Forest Highlands, Lake Oswego, OR",1748
"Forest Highlands, Portland, OR",13286
"Forest Hill Extension, San Francisco, CA",5332
"Forest Hill Terrace, Richmond, VA",5985
"Forest Hill, Moline, IL",9408
"Forest Hill, Newark, NJ",396
"Forest Hill, Richmond, VA",6296
"Forest Hill, San Francisco, CA",4502
"Forest Hills Gardens, NY, NY",13085
"Forest Hills North, Columbia, SC",7415
"Forest Hills, Cleveland, OH",2854
"Forest Hills, Columbia, SC",6996
"Forest Hills, Durham, NC",14104
"Forest Hills, Greenville, NC",8983
"Forest Hills, Harrisonburg, VA",14037
"Forest Hills, Hickory, NC",9462
"Forest Hills, NY, NY",2444
"Forest Hills, San Marcos, TX",14047
"Forest Hills, Savannah, GA",13995
"Forest Hills, Smyrna, GA",8948
"Forest Hills, Tampa, FL",11905
"Forest Hills, WA, DC",3329
"Forest Hills, Winston-Salem, NC",7312
"Forest Home Hills, Milwaukee, WI",3448
"Forest Home, Ithaca, NY",13378
"Forest Knoll North, Mesa, AZ",7330
"Forest Knolls, San Francisco, CA",4355
"Forest Lake, Tuscaloosa, AL",9424
"Forest Manor, Indianapolis, IN",2136
"Forest Oak, San Antonio, TX",7081
"Forest Oaks, Tulsa, OK",8075
"Forest Orchard, Tulsa, OK",6232
"Forest Park - Linnton, Portland, OR",5327
"Forest Park East, Columbus, OH",490
"Forest Park Golf Course, Baltimore, MD",7685
"Forest Park Southeast, Saint Louis, MO",4563
"Forest Park West, Columbus, OH",4543
"Forest Park, Baltimore, MD",5070
"Forest Park, Birmingham, AL",1860
"Forest Park, Detroit, MI",13280
"Forest Park, Kenosha, WI",9366
"Forest Park, Muncie, IN",9371
"Forest Park, Spartanburg, SC",9567
"Forest Park, Springfield, MA",335
"Forest Park, Winston-Salem, NC",5330
"Forest Pointe, Tulsa, OK",13840
"Forest Ridge Estates, Fort Wayne, IN",7754
"Forest Ridge, Gainesville, FL",10144
"Forest Ridge, Vancouver, WA",6440
"Forest Ridge-Quail Hollow, Dayton, OH",4462
"Forest Run Homeowners Association, Clearwater, FL",13684
"Forest Service-Mt. SI, North Bend, WA",15057
"Forest Springs, Arvada, CO",14080
"Forest Springs, Flagstaff, AZ",10315
"Forest Trails, Jacksonville, FL",11928
"Forest Trails, Tulsa, OK",7966
"Forest View Park, Nashville, TN",5857
"Forest View, Lansing, MI",8864
"Forest View, Richmond, VA",6721
"Forest Wood Homeowners Association, Clearwater, FL",13695
"Forest, Buffalo, NY",2839
"Forestdale, Malden, MA",8903
"Forestdale, Winston-Salem, NC",8134
"Forestland, Oakland, CA",5249
"Forests at Inwood, San Antonio, TX",15618
"Forestville, Cincinnati, OH",778
"Forge Ridge, Nashville, TN",8662
"Forman, Plano, TX",8996
"Forrest Hills, Augusta, GA",11865
"Forrestridge, Denton, TX",2362
"Forster Woods, North Bend, WA",10585
"Forsynthia Gate, Levittown, PA",10915
"Forsyth Forest, Winston-Salem, NC",7398
"Fort Bend - Houston, Houston, TX",237
"Fort Caroline Shores, Jacksonville, FL",1441
"Fort Concho East, San Angelo, TX",10332
"Fort Concho, San Angelo, TX",10330
"Fort Davis, WA, DC",4885
"Fort Dearborn Manor, Dearborn, MI",11465
"Fort Dupont, WA, DC",3703
"Fort George Island, Jacksonville, FL",13526
"Fort Greene, NY, NY",228
"Fort Hamilton, NY, NY",272
"Fort Howard, Green Bay, WI",1924
"Fort Lincoln, WA, DC",4630
"Fort Logan, Denver, CO",3029
"Fort Meadow, Marlborough, MA",10526
"Fort Negley, Chattanooga, TN",15455
"Fort Phantom, Abilene, TX",14990
"Fort Pierce North, Fort Pierce, FL",12464
"Fort Pierce South, Fort Pierce, FL",1299
"Fort Sanders, Knoxville, TN",1321
"Fort Totten, WA, DC",4517
"Fort Utah, Provo, UT",10737
"Fort Wadsworth, NY, NY",5258
"Fort Ward, Bainbridge Island, WA",9278
"Fort Washington, Upper Dublin, PA",4058
"Fortune's Ridge, Durham, NC",14544
"Fortwood Historic District, Chattanooga, TN",15453
"Forty Acres, Wilmington, DE",10348
"Fossil Hill Estates, Fort Worth, TX",8144
"Fossil Lake, Fort Collins, CO",14761
"Fossil Park, Fort Worth, TX",5107
"Fossil Park, Saint Petersburg, FL",4555
"Foster Park, Fort Worth, TX",5403
"Foster, Marion, IN",14221
"Foster-Powell, Portland, OR",3181
"Founders, Brooklyn Park, MN",11498
"Foundryville, Berwick, PA",7811
"Fountain Heights, Birmingham, AL",8772
"Fountain of the Sun, Mesa, AZ",1595
"Fountain Park, Saint Louis, MO",5707
"Fountain Parke, Lake Mary, FL",10971
"Fountain Square, Indianapolis, IN",9763
"Fountainwood Estates, Georgetown, TX",15083
"Four by Four, Baltimore, MD",6111
"Four Corners, Nashville, TN",4360
"Four Hills Village, Albuquerque, NM",1701
"Four Mables Condos, Nashville, TN",8438
"Four Mile Creek, Boulder, CO",7936
"Four Seasons Condos, Nashville, TN",7597
"Four Seasons, Palm Springs, CA",8970
"Four Seasons, South Brunswick, NJ",8715
"Four Way, Bartlett, TN",14898
"Fourth Addition, Pacific Grove, CA",11155
"Fourth and Gill, Knoxville, TN",6731
"Fourth Plain Village, Vancouver, WA",5075
"Fourth Ward, Charlotte, NC",4512
"Fourth Ward, Houston, TX",11927
"Fowl River, Irvington, AL",6826
"Fox Canyon, San Diego, CA",5394
"Fox Chase Meadows, Nashville, TN",13895
"Fox Chase, Loveland, OH",15061
"Fox Chase, Philadelphia, PA",358
"Fox Creek, Fort Collins, CO",14369
"Fox Creek, Stockton, CA",2860
"Fox Crossing, Chandler, AZ",5144
"Fox Glenn, Flagstaff, AZ",10316
"Fox Hills, Culver City, CA",11028
"Fox Hills, Fort Collins, CO",10402
"Fox Meadow Farms, Loveland, OH",15058
"Fox Meadows, Edina, MN",14459
"Fox Park, Saint Louis, MO",4822
"Fox Point, Providence, RI",4128
"Fox Point, Tulsa, OK",8193
"Fox Run, Bakersfield, CA",4884
"Fox Run, Fort Worth, TX",6378
"Fox Run, Fredericksburg, VA",14776
"Foxboro, Columbus, OH",4445
"Foxcroft Heights, Arlington, VA",5735
"Foxcroft, Charlotte, NC",1226
"Foxglen, La Verne, CA",14903
"Foxhall, Norfolk, VA",11184
"Foxhall, WA, DC",7105
"Foxhall, Winston-Salem, NC",7503
"Foxhill, Hampton, VA",876
"Foxstone, Fort Collins, CO",14753
"Foxtown East, Kansas City, MO",12972
"Foxwood Heights, Chattanooga, TN",11632
"Foxwood, Nashville, TN",8663
"Framingham, Columbus, OH",4250
"Frances Slocum, Fort Wayne, IN",12584
"Frances Slocum, Marion, IN",15143
"Francis Blvd, Lakeland, FL",13514
"Francisco Boulevard West, San Rafael, CA",15482
"Francisville, Philadelphia, PA",8882
"Frankford, Baltimore, MD",502
"Frankford, Philadelphia, PA",194
"Franklin Colonial, Roanoke, VA",2270
"Franklin Gateway, Waterloo, IA",15463
"Franklin Heights, Milwaukee, WI",3122
"Franklin Park, Austin, TX",12431
"Franklin Park, Columbus, OH",4642
"Franklin Park, Detroit, MI",804
"Franklin Park, Franklin Township, NJ",1827
"Franklin Park, Toledo, OH",547
"Franklin Park, Trenton, NJ",1352
"Franklin South, Provo, UT",10741
"Franklin Square, Baltimore, MD",4808
"Franklin to the Fort, Missoula, MT",1036
"Franklin, Marion, IN",14376
"Franklin, Provo, UT",9693
"Franklinton, Columbus, OH",3146
"Franklintown Road, Baltimore, MD",5549
"Franklintown, Baltimore, MD",6037
"Franklinville, Philadelphia, PA",9440
"Franz Park, Saint Louis, MO",5321
"Fraser Fields, Mesa, AZ",6133
"Frasier Meadows, Boulder, CO",4269
"Frazier, Palm Springs, CA",14931
"Frear Park, Troy, NY",9029
"Freedom Heights, Milwaukee, WI",13645
"Freedom Park, Charlotte, NC",4610
"Freemason Street Area Association, Norfolk, VA",11198
"Freemonteers, Garland, TX",7259
"Freeport Manor, Sacramento, CA",5846
"Freeport-Hackberry, Irving, TX",2224
"Fremont North, Oxnard, CA",10576
"Fremont Park, Glendale, CA",5599
"Fremont South, Oxnard, CA",14918
"Fremont, Oakland, CA",3601
"Fremont, Seattle, WA",2741
"French Court, Santa Ana, CA",4778
"French Creek Village, San Antonio, TX",12973
"French Hill, Marlborough, MA",9998
"French Park, Santa Ana, CA",4794
"French Quarter, Charleston, SC",2094
"French Quarter, New Orleans, LA",11931
"Frenchmens Creek, Shawnee, KS",10442
"Freret, New Orleans, LA",13163
"Fresh Meadows, NY, NY",361
"Fresno High Roeding, Fresno, CA",112
"Frick, Oakland, CA",4270
"Friedrich Wilderness Park, San Antonio, TX",1464
"Friendly Acres, Redwood City, CA",11516
"Friendly Area, Eugene, OR",3172
"Friendly Hope, Jonesboro, AR",14687
"Friendly Village of Aurora, Aurora, CO",15596
"Friends of Karl Wyler, El Paso, TX",15574
"Friendship Heights, WA, DC",5762
"Friendship, Pittsburgh, PA",5758
"Frierson Area, Jonesboro, AR",14690
"Frisbee Park, Des Moines, IA",8232
"Frisco Heights, Fort Worth, TX",13310
"Frisco Lakes, Olathe, KS",11348
"Frog Hollow, Hartford, CT",2938
"Frogpond, Jonesboro, AR",14086
"Front Park, Buffalo, NY",2725
"Front Range, Broomfield, CO",15115
"Frost farms, Desoto, TX",9850
"Fruit Hill, Cincinnati, OH",4427
"Fruit Valley, Vancouver, WA",5041
"Fruitland Heights, Saint Petersburg, FL",7011
"Fruitridge Manor, Sacramento, CA",3567
"Fruitvale Station, Oakland, CA",6327
"Fruitvale West, Saratoga, CA",14486
"Fruitvale, Saratoga, CA",9710
"Fruitville, Sarasota, FL",581
"Fry Springs, Charlottesville, VA",1513
"Fuller Avenue, Grand Rapids, MI",12675
"Fuller Park, Chicago, IL",13141
"Fuller Park, Napa, CA",11444
"Fuller Tangletown, Minneapolis, MN",3877
"Fulton Heights, Grand Rapids, MI",12284
"Fulton River District, Chicago, IL",1363
"Fulton, Minneapolis, MN",1192
"Fulton, Richmond, VA",3859
"Fulton, Tulsa, OK",6374
"FW Vista West, Fort Worth, TX",5955
"Gadsden Green, Charleston, SC",10651
"Gaffney Lane, Oregon City, OR",10493
"Gage Park, Chicago, IL",198
"Gail Gardener, Prescott, AZ",10902
"Gailyn Manor Estates, Bartlett, TN",10489
"Gains Creek, Columbus, GA",14568
"Gainsboro, Roanoke, VA",10660
"Gainsborough West, Brookhaven, GA",15229
"Galaxie Commons, Apple Valley, MN",10925
"Galewood, Chicago, IL",583
"Galindo, Austin, TX",11932
"Gallaudet, WA, DC",5695
"Galloway Ridge, Columbus, OH",4405
"Galludet, Indianapolis, IN",2143
"Galt Mile, Fort Lauderdale, FL",11871
"Galveston, Chandler, AZ",3792
"Galway Hills, Iowa City, IA",14701
"Gandy-Sun Bay South, Tampa, FL",587
"Garden Acres, Bryan, TX",15499
"Garden Acres, Fort Worth, TX",3791
"Garden Acres, Longmont, CO",10813
"Garden Acres, Oakland Park, FL",9949
"Garden Cicle, Miami Gardens, FL",10266
"Garden City, Indianapolis, IN",2064
"Garden City, Jacksonville, FL",12282
"Garden City, Roanoke, VA",9400
"Garden Court, Philadelphia, PA",9783
"Garden District, Monroe, LA",14348
"Garden District, New Orleans, LA",12943
"Garden District, Tucson, AZ",3133
"Garden Gate, Cupertino, CA",14425
"Garden Heights, Altoona, PA",15073
"Garden Highlands, Birmingham, AL",9547
"Garden Hills, Atlanta, GA",11867
"Garden Hills, Mesa, AZ",7837
"Garden Homes, Milwaukee, WI",4908
"Garden Isles, Pompano Beach, FL",11858
"Garden Lakes, Avondale, AZ",2288
"Garden Manor Lake, Saint Petersburg, FL",7299
"Garden Manor, Saint Petersburg, FL",7548
"Garden Meadows, Bartlett, TN",11765
"Garden Springs, Lexington, KY",12110
"Garden View, Winston-Salem, NC",13701
"Gardenland, Sacramento, CA",4268
"Gardens of Westridge, Fort Worth, TX",13867
"Gardens, Pompano Beach, FL",5446
"Gardenside-Colony, Lexington, KY",1065
"Gardiner Lane, Louisville, KY",12845
"Garfield Heights, WA, DC",4437
"Garfield Park, Corvallis, OR",14802
"Garfield Park, Grand Rapids, MI",541
"Garfield Park, Indianapolis, IN",9764
"Garfield Ridge, Chicago, IL",298
"Garfield, Albany, CA",9441
"Garfield, Marion, IN",14266
"Garfield, Pittsburgh, PA",4081
"Garfield, Seattle, WA",4993
"Garland, Mobile, AL",5284
"Garment District, NY, NY",11962
"Garrad Woods, Columbus, GA",14571
"Garrison Park, Austin, TX",11899
"Garton West, Des Moines, IA",8490
"Garwyn Oaks, Baltimore, MD",6497
"Gary, Duluth, MN",8958
"Gaskill, Oakland, CA",5396
"Gaslamp Quarter, San Diego, CA",6380
"Gaslight-Warehouse District, Manchester, NH",15506
"Gate City, Birmingham, AL",8773
"Gate N Green, Broomfield, CO",15126
"Gates Park, Waterloo, IA",15465
"Gateway - Green Valley Ranch, Denver, CO",253
"Gateway Center, Sacramento, CA",5204
"Gateway Court, Gilbert, AZ",8486
"Gateway Park, Gainesville, FL",10130
"Gateway Ranch, Gilbert, AZ",6066
"Gateway Village, Gilbert, AZ",7329
"Gateway West, Sacramento, CA",3470
"Gateway, Camden, NJ",8803
"Gateway, Columbus, OH",13328
"Gateway, Dayton, OH",6010
"Gateway, Saint Petersburg, FL",4580
"Gateway, WA, DC",6649
"Gateway- Waterway, Venice, FL",10491
"Gatewood Estates, Garland, TX",8293
"Gatewood UCD, Oklahoma City, OK",11142
"Gatewood, Muncie, IN",14337
"Gatewood, Seattle, WA",3327
"Gatlinburg, Pflugerville, TX",9505
"Gay Street, Baltimore, MD",5572
"Gayland, Nashville, TN",13905
"Geiger Street, Covington, GA",10359
"Geist, Indianapolis, IN",2147
"Gemello Park, Mountain View, CA",15002
"Gene Autry, Palm Springs, CA",9053
"General Iron Works, Englewood, CO",14472
"General Krueger, San Antonio, TX",13028
"Genesee - Jefferson, Rochester, NY",3708
"Genesee Moselle, Buffalo, NY",3893
"Genesee, Lansing, MI",9597
"Genesee, Seattle, WA",4966
"Genesis Park, Charlotte, NC",7372
"Geneva Heights, Orem, UT",10323
"Gentilly Terrace, New Orleans, LA",882
"Gentilly Woods, New Orleans, LA",12938
"George Blessing, Round Rock, TX",15314
"Georgetown Community, Jackson, MS",12748
"Georgetown Condos, Fort Collins, CO",10398
"Georgetown Condos, Nashville, TN",8143
"Georgetown Village, Georgetown, TX",10909
"Georgetown, Aurora, IL",9666
"Georgetown, NY, NY",745
"Georgetown, Savannah, GA",1092
"Georgetown, Seattle, WA",5382
"Georgetown, South Bend, IN",12486
"Georgetown, WA, DC",2730
"Georgetown, Winston-Salem, NC",6220
"Georgia Avenue, Mobile, AL",5962
"Georgia Tech, Atlanta, GA",13068
"Georgian Acres, Austin, TX",11995
"Georgian Heights, Columbus, OH",4014
"German Town, Quincy, MA",8904
"German Village Commission, Columbus, OH",5118
"Germania Park, Birmingham, AL",8774
"Germantown East, Philadelphia, PA",404
"Germantown Meadows, Dayton, OH",5682
"Germantown Morton, Philadelphia, PA",2153
"Germantown Penn Knox, Philadelphia, PA",9770
"Germantown Southwest, Philadelphia, PA",2154
"Germantown West Central, Philadelphia, PA",9769
"Germantown Westside, Philadelphia, PA",9771
"Germantown, Louisville, KY",12104
"Germantown, Nashville, TN",7179
"Germany Hill, Philadelphia, PA",2165
"Gerritsen Beach, NY, NY",1221
"Gerstle Park, San Rafael, CA",11674
"Gert Town, New Orleans, LA",13086
"Getty Square, Yonkers, NY",15328
"Ghent Square, Norfolk, VA",11199
"Ghent, Norfolk, VA",2011
"Gibbs, Canton, OH",8971
"Gibson Springs, Henderson, NV",2747
"Gibson Village, Concord, NC",10707
"Gibsonia, Richland Township, PA",12576
"Gilbert and Ray Estates, Gilbert, AZ",7799
"Gilbert Commons, Gilbert, AZ",6775
