AREA,CODE
"Marble Hill, NY, NY",2993
"Marcy Holmes, Minneapolis, MN",2951
"Mardis, Jonesboro, AR",14681
"Margaret Mitchell, Atlanta, GA",12301
"Margate Park, Chicago, IL",1060
"Marian-Cold Springs, Indianapolis, IN",9760
"Marietta Street Artery, Atlanta, GA",13147
"Marietta, Jacksonville, FL",1536
"Marigny, New Orleans, LA",12390
"Marilyn Ann, Tempe, AZ",6612
"Marina Area, Long Beach, CA",1465
"Marina Bay, Richmond, CA",11521
"Marina District, Des Moines, WA",10588
"Marina District, Detroit, MI",12425
"Marina District, Oshkosh, WI",14886
"Marina Faire, San Leandro, CA",10724
"Marina Park, Redwood City, CA",11517
"Marina Village, Alameda, CA",15459
"Marina West, Oxnard, CA",10568
"Marina, Alameda, CA",14231
"Marina, San Diego, CA",1233
"Marina, San Francisco, CA",2743
"Marina, Ventura, CA",8817
"Marine Creek Hills, Fort Worth, TX",7311
"Marine Creek Ranch, Fort Worth, TX",6061
"Marine Creek, Fort Worth, TX",6425
"Marine Hills, Federal Way, WA",9867
"Marine Park, Fort Worth, TX",7479
"Marine Park, NY, NY",320
"Marine Villa, Saint Louis, MO",4977
"Marine, Elkhart, IN",14254
"Marine, Redwood City, CA",14026
"Marineland, Saint Augustine, FL",13667
"Mariner's Harbor, NY, NY",638
"Mariners Island, San Mateo, CA",5058
"Mariners Pass, Saint Petersburg, FL",8575
"Mariners Village, Orlando, FL",12630
"Marinwood, San Rafael, CA",8729
"Marion Franklin, Columbus, OH",3693
"Marion High School, Marion, IN",14403
"Mariposa, Glendale, CA",2640
"Mariposa, Stockton, CA",8335
"Mark Twain, Albuquerque, NM",12403
"Mark Twain, Richardson, TX",5010
"Mark Twain, Saint Louis, MO",3926
"Mark Twain, Springfield, MO",9622
"Mark Twain-I-70 Industrial, Saint Louis, MO",5003
"Market Heights, Canton, OH",11247
"Market-Downtown, Kirkland, WA",6696
"Markham, Portland, OR",4947
"Marlborough at Dana Ranch, Mesa, AZ",6254
"Marlborough Heights - Marlborough Pride, Kansas City, MO",12558
"Marlborough Mesa, Mesa, AZ",5953
"Marlborough Square, Richardson, TX",7507
"Marlin, Redwood City, CA",14294
"Marlton, Camden, NJ",2061
"Marlwood, Charlotte, NC",3484
"Marlyville-Fontainebleau, New Orleans, LA",1103
"Marquette Park, Chicago, IL",259
"Marquette Park, Green Bay, WI",11476
"Marquette Park-Miller, Gary, IN",10894
"Marquette, Madison, WI",3712
"Marrion, Vancouver, WA",4783
"Marriott's Griffin Gate Golf Club, Lexington, KY",1319
"Marrowbone, Nashville, TN",3700
"Mars Hill, Indianapolis, IN",1833
"Marshall - Shadeland, Pittsburgh, PA",1207
"Marshall Heights, WA, DC",1273
"Marshall Park, Portland, OR",5328
"Marshall School, Sacramento, CA",5292
"Marshall Terrace, Minneapolis, MN",5836
"Marshbrooke, Charlotte, NC",3303
"Marston, Denver, CO",2886
"Marstons Mills, Barnstable, MA",1006
"Martens-Carmelita, Mountain View, CA",10797
"Martha Jefferson, Charlottesville, VA",12305
"Martha Lake, Lynnwood, WA",2621
"Martin Acres, Boulder, CO",3857
"Martin Boots, Marion, IN",10976
"Martin Drive, Milwaukee, WI",5792
"Martin Luther King Dr. Area, Shreveport, LA",15544
"Martin Luther King, Beaumont, TX",11262
"Martin Luther King, Chattanooga, TN",11637
"Martin Luther King, Columbia, SC",6069
"Martin Park, Detroit, MI",12493
"Martin, Manchester, CT",2069
"Martin-Hickman, Des Moines, IA",7937
"Martindale-Brightwood, Indianapolis, IN",2137
"Martineztown, Albuquerque, NM",15614
"Martinique, Jupiter, FL",14787
"Martinque, Gilbert, AZ",7727
"Martinsville, Bridgewater, NJ",1433
"Martinwood Heights, Nashville, TN",8530
"Marvin Beach, Norwalk, CT",14963
"Marwyn-Lindley, Bozeman, MT",9826
"Mary Dell, Durham, NC",14038
"Mary Munford, Richmond, VA",5915
"Marycrest, Chicago, IL",6469
"Marylhurst, West Linn, OR",8739
"Marynook, Chicago, IL",4390
"Maryvale, Mobile, AL",3825
"Maryvale, Phoenix, AZ",3
"Mason City, Birmingham, AL",8784
"Masonic Hill, Park City, UT",11972
"Maspeth, NY, NY",133
"Massachusetts Heights, WA, DC",13473
"Masten Park, Buffalo, NY",4315
"Masterpiece Estates, Bakersfield, CA",7962
"Mather and Wells, Ogden, UT",10165
"Mather Heights, Green Bay, WI",11473
"Matheson Park, Albuquerque, NM",13027
"Matinez park, Fort Collins, CO",14818
"Matlock Heights, Wichita, KS",12705
"Mattapan, Boston, MA",2495
"Matthews Beach, Seattle, WA",3511
"Maureen Highlands, Renton, WA",7933
"Max Brandon Park S.E., Flint, MI",10189
"Max Campbell, Tulsa, OK",7305
"Maxey Park, Lubbock, TX",11187
"Maximo, Saint Petersburg, FL",6397
"Maxwell Park, Oakland, CA",3458
"Maxwell Place, Nashville, TN",8572
"Maxwell, Tulsa, OK",5128
"May Creek, Renton, WA",13806
"May Park, Augusta, GA",13294
"May Ranch, Mill Valley, CA",14907
"May Valley, Richmond, CA",8836
"Mayfair Park, Madison, WI",6191
"Mayfair Park, Wauwatosa, WI",9887
"Mayfair, Baton Rouge, LA",9623
"Mayfair, Chicago, IL",3016
"Mayfair, Oklahoma City, OK",9095
"Mayfair, Philadelphia, PA",256
"Mayfair, Savannah, GA",14004
"Mayfair, WA, DC",4366
"Mayfield Ranch Enclave, Round Rock, TX",11254
"Mayfield, Baltimore, MD",7956
"Mayfield, Fredericksburg, VA",9229
"Mayflower Park, Portsmouth, VA",10720
"Mayflower, Wilkes-Barre, PA",9185
"Maymont, Richmond, VA",7547
"Maynor Place, Nashville, TN",8264
"Mayo Meadow, Tulsa, OK",5445
"Mayo Plaza, Tulsa, OK",7864
"Mayor's Heights, Rochester, NY",4949
"Mayport, Jacksonville, FL",13126
"Mays, Atlanta, GA",6621
"Maysville Heights, Fort Wayne, IN",7570
"Maysville, Mobile, AL",4851
"Maywood, Arlington, VA",6140
"Maywood, Indianapolis, IN",15637
"Maywood, Waterloo, IA",14277
"Mazyck-Wraggborough, Charleston, SC",14947
"McAfee Heights, Mesa, AZ",7773
"McAlister Parkway, Topeka, KS",10096
"McArthur Park, Jonesboro, AR",14692
"McArthur, Irving, TX",9049
"McAuliffe Park, Green Bay, WI",11487
"McBean, Augusta, GA",1454
"McCarty Park, West Allis, WI",15031
"McClellan Heights, Davenport, IA",15365
"McClellan Park, Madison, WI",1691
"McClellan Park, Sarasota, FL",13640
"McClintock Manor, Tempe, AZ",7228
"McClintock, Tempe, AZ",6392
"McCluer Road, Jackson, MS",12645
"McClure Park, Tulsa, OK",1309
"McClymonds, Oakland, CA",4685
"McConnells Trace, Lexington, KY",10581
"McCook Field, Dayton, OH",6414
"Mccormick, Wichita, KS",12139
"McCoy, Independence, MO",9186
"McCrorey Heights, Charlotte, NC",7444
"McCullough Hills, Henderson, NV",665
"McCully-Moiliili, Honolulu, HI",2541
"McDade, Augusta, GA",12824
"McDonogh, New Orleans, LA",13125
"McDougal, Belmont, CA",13926
"McDougall-Hunt, Detroit, MI",12844
"McElderry Park, Baltimore, MD",1353
"McEwen, Franklin, TN",2614
"McFerrin Park, Nashville, TN",5190
"McGeoach Meadows, West Allis, WI",15041
"McGinley Square, Jersey City, NJ",470
"McGirts Creek, Jacksonville, FL",12052
"McGlincy, Campbell, CA",14440
"McGovern Park, Milwaukee, WI",4161
"McGregor Downs, Winston-Salem, NC",7769
"McGuire Manor, Richmond, VA",5965
"McGuire, Philadelphia, PA",9738
"McGuire, Richmond, VA",6472
"McIntosh, Longmont, CO",12978
"McKay Landing, Broomfield, CO",15113
"McKinley & Railroad Parks, Saint Cloud, MN",10437
"McKinley Heights, Saint Louis, MO",6410
"Mckinley Mitchell, Tulsa, OK",3788
"McKinley Park, Chicago, IL",12013
"McKinley Park, Stockton, CA",2926
"McKinley School - Columbus Park, Des Moines, IA",5516
"McKinley Terrace, South Bend, IN",12881
"McKinley, Albuquerque, NM",12556
"McKinley, Kenosha, WI",1928
"Mckinley, Minneapolis, MN",4969
"McKinley, Muncie, IN",15383
"Mckinney, Austin, TX",12154
"McKnight, Springfield, MA",3733
"Mclane, Fresno, CA",2462
"McLaughlin, Culver City, CA",8717
"McLean Gardens, WA, DC",5852
"McLemore, Franklin, TN",6583
"McLoughlin, Oregon City, OR",10504
"McManus, Culver City, CA",15168
"Mcmillian Mesa, Independence, MO",10307
"McMurray - Huntingdon, Nashville, TN",3250
"McMurray Court, Nashville, TN",8681
"Mcnamee-Shriver, Cumberland, MD",2179
"McNaughton, Elkhart, IN",8758
"Mcoy Estates, Carrollton, TX",14596
"McPherson Ranch, Fort Worth, TX",5248
"McPherson, Dayton, OH",6997
"Mcpherson, Napa, CA",9401
"McPherson-Pioneer Ranch, Cathedral City, CA",10497
"McVey-South Shore, Lake Oswego, OR",1755
"McVoy, Mobile, AL",5133
"Mead, Wichita, KS",12147
"Meade Vue, Nashville, TN",8538
"Meador Park, Springfield, MO",11244
"Meadow Brook, Oakland, CA",3488
"Meadow Creek, Fort Worth, TX",3942
"Meadow Glen, Arvada, CO",14675
"Meadow Hills, Aurora, CO",3538
"Meadow Homes, Vancouver, WA",4983
"Meadow Lake, Arvada, CO",9677
"Meadow Oaks, Roseville, CA",5561
"Meadow Park, Gilbert, AZ",13669
"Meadow Park, Muncie, IN",15422
"Meadow Park, Rochester, MN",11396
"Meadow Ridge- Harvest Run, Carrollton, TX",10178
"Meadow Village, San Antonio, TX",12116
"Meadow Wood, Aurora, CO",3289
"Meadow Woods, Orlando, FL",411
"Meadowbrook - Allendale, Houston, TX",12427
"Meadowbrook Estates, Desoto, TX",9852
"Meadowbrook Forest, Atlanta, GA",13548
"Meadowbrook Forest-Huntclub-Meadowbrook, Norfolk, VA",14189
"Meadowbrook Village, Gilbert, AZ",8432
"Meadowbrook Woods, Norfolk, VA",15299
"Meadowbrook, Augusta, GA",1044
"Meadowbrook, Norfolk, VA",14188
"Meadowbrook, Saint Louis Park, MN",9325
"Meadowbrook, Seattle, WA",4229
"Meadowbrook, Syracuse, NY",3569
"Meadowbrook-Tollgate, Provo, UT",15072
"Meadowcreek Village, Garland, TX",7353
"Meadowfield, Columbia, SC",6320
"Meadowlane, Lincoln, NE",3794
"Meadowlark, Fort Collins, CO",10392
"Meadowlark, Wichita, KS",12848
"Meadowlawn Area, Danville, IL",14492
"Meadowlawn, Saint Petersburg, FL",1075
"Meadowmere, West Allis, WI",15040
"Meadowood, Butler Township, PA",1622
"Meadowood, Claremont, CA",14339
"Meadowood, Garland, TX",7349
"Meadowood, Madison, WI",4744
"Meadows at Cambridge Heights, Pflugerville, TX",15444
"Meadows at Seven Points, Nashville, TN",8445
"Meadows East, Fort Collins, CO",14741
"Meadows of Blackhawk, Pflugerville, TX",11578
"Meadows of Candleridge, Fort Worth, TX",5233
"Meadows of Chandler Creek, Round Rock, TX",11245
"Meadows Village, Las Vegas, NV",4333
"Meadows West, Fort Worth, TX",6433
"Meadows, Indianapolis, IN",2111
"Meadows, Plano, TX",9667
"Meadowthorpe, Lexington, KY",5290
"Meadowview Acres, Nashville, TN",8594
"Meadowview, North Bergen, NJ",9231
"Meadowview, Sacramento, CA",316
"Meadowview, Ypsilanti, MI",9230
"Mears Corner, Virginia Beach, VA",257
"Mechanicsville, Atlanta, GA",12183
"Mechanicsville, Knoxville, TN",5287
"Mechanicsville, Philadelphia, PA",14136
"Medfield, Baltimore, MD",4894
"Medford, Baltimore, MD",5989
"Media, Burbank, CA",9490
"Medial Avenue, Nashville, TN",13824
"Medical Arts, Arvada, CO",15350
"Medical Center Area, Houston, TX",13004
"Medical Center, Sacramento, CA",5596
"Medical District, Englewood, CO",14864
"Medical Park, Buffalo, NY",5399
"Medlock-North Decatur, Decatur, GA",11074
"Meeker North, Ames, IA",15491
"Meiers Corners, NY, NY",2824
"Mel-Tan Heights, Saint Petersburg, FL",7481
"Mellwood, Atlanta, GA",8173
"Melody Lake, Edina, MN",9890
"Melody Ranch, Palm Springs, CA",10983
"Melody View, Milwaukee, WI",8070
"Melrose Heights, Columbia, SC",1698
"Melrose Heights, Nashville, TN",8678
"Melrose Highlands, Melrose, MA",8911
"Melrose Manors, Fort Lauderdale, FL",12096
"Melrose Mercy - Pine Acres, Saint Petersburg, FL",5357
"Melrose Park Gardens, Philadelphia, PA",9786
"Melrose Park, Fort Lauderdale, FL",3205
"Melrose Place, Tulsa, OK",6360
"Melrose, Albany, NY",5260
"Melrose, Iowa City, IA",14390
"Melrose, Mobile, AL",7692
"Melrose, Nashville, TN",5097
"Melrose, NY, NY",2489
"Melrose, Oakland, CA",6478
"Melrose-Rugby, Roanoke, VA",2258
"Melton, Jonesboro, AR",14684
"Memorial Boulevard, Newport, RI",11032
"Memorial Forest, Bryan, TX",11713
"Memorial Heights, San Antonio, TX",15642
"Memorial Park, Arvada, CO",10222
"Memorial Park, Atlanta, GA",13545
"Memorial Park, Fort Wayne, IN",6662
"Memorial Park, Lake Worth, FL",11056
"Memorial Park, Longview, WA",9856
"Memorial Park, Santa Ana, CA",2819
"Memorial Square, Springfield, MA",3625
"Memorial, Houston, TX",157
"Mendota Hills, Madison, WI",8073
"Menlo Oaks, Menlo Park, CA",12787
"Menlo Park, Tucson, AZ",3487
"Menominee South, Oshkosh, WI",14890
"Menomonee River Hills East, Milwaukee, WI",4198
"Menomonee River Hills, Milwaukee, WI",923
"Menomonee River Parkway, Milwaukee, WI",7232
"Menomonee River Valley, Milwaukee, WI",13119
"Merced Heights, San Francisco, CA",4347
"Merced Manor, San Francisco, CA",6387
"Mercer, Shaker Heights, OH",9497
"Mercerville, Hamilton Township, NJ",382
"Merchants, Fall River, MA",11542
"Mercury Central, Hampton, VA",765
"Mercy Drive, Orlando, FL",12209
"Merdian, Bellingham, WA",6567
"Meredith Parkwood, Santa Ana, CA",4864
"Meredith, Des Moines, IA",4000
"Meridian Avenue Corridor, Oklahoma City, OK",2326
"Meridian Hills, Mesa, AZ",6366
"Meridian Inernational Business Center, Parker, CO",14958
"Meridian Kessler, Indianapolis, IN",9761
"Meridian Park, Shoreline, WA",10937
"Meridian Pointe, Mesa, AZ",7385
"Meridian, Butler Township, PA",1626
"Merion Village, Columbus, OH",3416
"Merit-Carson, Torrance, CA",7583
"Merle Hay, Des Moines, IA",840
"Merlin Park, Town of Niskayuna, NY",14508
"Merriam Park, Saint Paul, MN",478
"Merrick Moore, Durham, NC",14537
"Merrifields, Portsmouth, VA",10715
"Merrill Park, Milwaukee, WI",4467
"Merriman Valley, Akron, OH",1453
"Merrimont Hills, Winston-Salem, NC",7684
"Merrimont, Winston-Salem, NC",7441
"Merritt Downs, Nashville, TN",7841
"Merritt, Oakland, CA",3781
"Merriwether, Louisville, KY",12737
"Merriwood, Oakland, CA",4297
"Merry Oaks, Nashville, TN",6676
"Merrymount Acres, Nashville, TN",8460
"Merrymount, Quincy, MA",14050
"Mertz, Mobile, AL",5881
"Mesa Grande, Mesa, AZ",3564
"Mesa Hills, El Paso, TX",12956
"Mesa Madrid, Mesa, AZ",7774
"Mesa Mobile Home Estates III, Mesa, AZ",15582
"Mesa Valley View, Mesa, AZ",7662
"Mesa Vista II, Mesa, AZ",7112
"Mesafield, Mesa, AZ",7826
"Mesquite Park, Mesquite, TX",10201
"Mesquite Ranch, Tucson, AZ",6435
"Mesta Park, Oklahoma City, OK",11140
"Metawanee Hills, Flint, MI",14603
"Metcalfe Park, Milwaukee, WI",4689
"Methodist Town, Saint Petersburg, FL",6451
"Metro Center, Sacramento, CA",6365
"Metro Center, Springfield, MA",3167
"Metro Classic, Santa Ana, CA",6457
"Metro West, Orlando, FL",11822
"Metropolitan, Savannah, GA",2348
"Meydenbauer, Bellevue, WA",4063
"Meyer Park, Tempe, AZ",4118
"Meyerland Area, Houston, TX",11814
"Miami Chapel, Dayton, OH",5368
"Micajah Heights, Plymouth, MA",11008
"Michael Way, Las Vegas, NV",139
"Michiana, New Buffalo, MI",13750
"Michigan Avenue, Fort Wayne, IN",6691
"Michigan Oaks, Grand Rapids, MI",12674
"Michigan Park, WA, DC",4127
"Michigan-Glide-Sutter, West Sacramento, CA",9799
"Michigan-Martin, Detroit, MI",13285
"Mid - City, Santa Ana, CA",2959
"Mid Central, Pasadena, CA",3085
"Mid City West, Los Angeles, CA",154
"Mid City, Baton Rouge, LA",9624
"Mid City, Los Angeles, CA",40
"Mid Heights, Loveland, OH",10858
"Mid Lakewood, Lakewood, CO",14559
"Mid Tulsa, Tulsa, OK",7200
"Mid Wilshire, Los Angeles, CA",176
"Mid-Cambridge, Cambridge, MA",2755
"Mid-City, New Orleans, LA",12922
"Mid-City, Santa Monica, CA",9554
"Mid-Govans, Baltimore, MD",4931
"Mid-Hillside, Anchorage, AK",1276
"Mid-Town Belvedere, Baltimore, MD",3730
"Mid-Westside, Jacksonville, FL",1054
"Middle East, Baltimore, MD",1636
"Middle Fork, North Bend, WA",14920
"Middle Hill, Pittsburgh, PA",5470
"Middle River Terrace, Fort Lauderdale, FL",12089
"Middle Towne Arch, Norfolk, VA",11202
"Middle Village, NY, NY",249
"Middlebury South, Elkhart, IN",15250
"Middlebury, Akron, OH",1146
"Middlefield, Redwood City, CA",14242
"Midland Beach, NY, NY",847
"Midland Terrace, Columbia, SC",7033
"Midland, Moreno Valley, CA",2109
"Midlothian, Richmond, VA",4141
"Midtown - Winn Park Capital Avenue, Sacramento, CA",3304
"Midtown Brandywine, Wilmington, DE",14698
"Midtown East, Owensboro, KY",14722
"Midtown Phillips, Minneapolis, MN",3723
"Midtown Terrace, San Francisco, CA",4307
"Midtown West, Stockton, CA",3044
"Midtown, Agoura Hills, CA",10015
"Midtown, Anchorage, AK",12072
"Midtown, Atlanta, GA",527
"Midtown, Detroit, MI",12460
"Midtown, Gary, IN",10817
"Midtown, Grand Rapids, MI",12103
"Midtown, Harrisburg, PA",2095
"Midtown, Houston, TX",925
"Midtown, Jacksonville, FL",13588
"Midtown, Key West, FL",9166
"Midtown, Little Rock, AR",902
"Midtown, Memphis, TN",83
"Midtown, Milwaukee, WI",3232
"Midtown, Monroe, LA",15416
"Midtown, New Albany, IN",2078
"Midtown, NY, NY",488
"Midtown, Ocean City, MD",10515
"Midtown, Palm Springs, CA",10984
"Midtown, Palmetto, FL",11115
"Midtown, Palo Alto, CA",2870
"Midtown, Saint Louis, MO",13073
"Midtown, San Diego, CA",3688
"Midtown, Savannah, GA",2339
"Midtown, Ventura, CA",2407
"Midtown, Ypsilanti, MI",14506
"Midtown-Edmondson, Baltimore, MD",4970
"Midvale Heights Community, Madison, WI",4577
"Midvale Park, Tucson, AZ",2647
"Midway District, San Diego, CA",2852
"Midway Manor, Allentown, PA",11312
"Midway, Henderson, NV",4959
"Midway, Saint Paul, MN",2756
"Midwest Cascade, Atlanta, GA",6056
"Midwood, NY, NY",91
"Mil-Lake Estates, Greenacres, FL",11157
"Milam-Jones, Bryan, TX",11708
"Milan Woods, Durham, NC",10057
"Milan, New Orleans, LA",12363
"Milbrook, Columbus, OH",5721
"Milburn, Overland Park, KS",4991
"Miles East West, Tucson, AZ",6331
"Miles, Elkhart, IN",14255
"Military, Buffalo, NY",3900
"Milkhouse, Mobile, AL",1405
"Mill Basin, NY, NY",1086
"Mill Creek Crossing, Garland, TX",6973
"Mill Creek Pond, Tulsa, OK",8002
"Mill Creek, Independence, MO",9097
"Mill Creek, Kent, WA",9326
"Mill Creek, Levittown, PA",9098
"Mill Creek, Philadelphia, PA",802
"Mill Creek, Springfield, IL",14311
"Mill Hill, Baltimore, MD",5556
"Mill Hill, Bridgeport, CT",8847
"Mill Hill, Trenton, NJ",6724
"Mill Park, Portland, OR",2856
"Mill Plain, Waterbury, CT",1878
"Mill Pond, Gainesville, FL",10136
"Mill River, New Haven, CT",13153
"Mill Run, Columbus, OH",6916
"Mill Run, Nashville, TN",8376
"Mill Valley, Milwaukee, WI",6520
"Millbrook, Grand Rapids, MI",12061
"Millbrook, Philadelphia, PA",9096
"Millenia, Orlando, FL",11984
"Millenium Village, Detroit, MI",12773
"Miller Court-Arrowood, Roanoke, VA",10666
"Miller Creek, Missoula, MT",12746
"Miller Orchard, Iowa City, IA",14706
"Miller Southside, Blacksburg, VA",15105
"Miller Valley, Milwaukee, WI",5731
"Miller-Molino, Mill Valley, CA",15182
"Millers Bay, Oshkosh, WI",14889
"Millers Creek, Mobile, AL",6939
"Millersville, Indianapolis, IN",1902
"Millerville, Baton Rouge, LA",12919
"Millet Ranch, Gilbert, AZ",7135
"Millham, Marlborough, MA",10527
"Millhaven, Winston-Salem, NC",13779
"Millicent Crossing, Tulsa, OK",8040
"Mills Ranch, Rancho Cordova, CA",10883
"Millsmont, Oakland, CA",3849
"Millstone, Madison, WI",13801
"Millview East, San Marcos, TX",15047
"Millview West, San Marcos, TX",15045
"Millville, Tucson, AZ",6915
"Millwood Creek, Richardson, TX",8291
"Millwood Estates, Tulsa, OK",7405
"Milneburg, New Orleans, LA",1455
"Milo-Grogan, Columbus, OH",5665
"Milpas, Santa Barbara, CA",6110
"Milton - Montford, Baltimore, MD",6085
"Milwaukee Junction, Detroit, MI",13385
"Milwaukie Business-Indust, Milwaukie, OR",13288
"Milwood, Kalamazoo, MI",957
"Mineral Springs, Winston-Salem, NC",5713
"Mineral Springs-Rumble Road, Charlotte, NC",3115
"Miners' Mills, Wilkes-Barre, PA",9099
"Mingo Valley, Tulsa, OK",5246
"Minikahda Oaks, Saint Louis Park, MN",14451
"Minikahda Vista, Saint Louis Park, MN",15518
"Minnehaha Woods, Edina, MN",14463
"Minnehaha, Minneapolis, MN",3996
"Minnehaha, Saint Louis Park, MN",14449
"Minnehaha, Spokane, WA",1529
"Minnetex, Houston, TX",1122
"Minnetrista, Muncie, IN",8961
"Minock Park, Detroit, MI",12818
"Minooka, Scranton, PA",9100
"Minor, Seattle, WA",3054
"Minshall Park, Tulsa, OK",4554
"Mint Farm, Monroe, LA",14441
"Mint Valley, Longview, WA",9855
"Mira Mesa, Mesa, AZ",7341
"Mira Mesa, San Diego, CA",72
"Mira Vista Place, Gilbert, AZ",7869
"Mira Vista, Fort Worth, TX",1713
"Mirabella, Albuquerque, NM",12405
"Miracle Manor, Tucson, AZ",4592
"Mirador Estates, Gilbert, AZ",7508
"Miraloma Park, San Francisco, CA",3851
"Miramar Ranch North, San Diego, CA",2690
"Miramar, Jacksonville, FL",1685
"Miramont, Fort Collins, CO",10404
"Miramonte, Broomfield, CO",13964
"Miramonte, Tucson, AZ",1364
"Miro Meadows, Nashville, TN",5135
"Mirror Lake, Federal Way, WA",1939
"Mirror Lake, Plantation, FL",2208
"Mirrormont, Issaquah, WA",9286
"Mission Bay Mobile Home Park, Cathedral City, CA",14971
"Mission Bay Park, San Diego, CA",863
"Mission Bay, San Francisco, CA",13081
"Mission Beach, San Diego, CA",4231
"Mission District, San Marino, CA",5035
"Mission Grove, Escondido, CA",14615
"Mission Grove, Riverside, CA",2987
"Mission Hill, Boston, MA",2689
"Mission Hills Condominium Association, Clearwater, FL",12882
"Mission Hills, El Paso, TX",1368
"Mission Hills, Fort Collins, CO",14236
"Mission Hills, Fremont, CA",5153
"Mission Hills, Henderson, NV",3719
"Mission Hills, Los Angeles, CA",2579
"Mission Hills, San Diego, CA",1246
"Mission Lake, Kansas City, MO",12379
"Mission Manor at Ray Ranch, Chandler, AZ",8001
"Mission Ridge, Tempe, AZ",13677
"Mission San Jose, Fremont, CA",3226
"Mission San Jose, San Antonio, TX",12512
"Mission Terrace, San Francisco, CA",2843
"Mission Tierra, Chandler, AZ",7335
"Mission Trace-Vance Jackson, San Antonio, TX",6845
"Mission Valley East, San Diego, CA",2898
"Mission Valley West, San Diego, CA",4728
"Mission Valley, Chandler, AZ",6702
"Mission Valley, Fremont, CA",3234
"Mission Viejo, Aurora, CO",3158
"Mission, San Francisco, CA",2454
"Mission-Foothill, Hayward, CA",3082
"Mission-Garin, Hayward, CA",3094
"Missionary Ridge, Chattanooga, TN",2391
"Mistletoe Heights, Fort Worth, TX",6900
"Misty Meadows, Columbus, OH",5491
"Misty Oaks, San Antonio, TX",12735
"Misty Sprints Condominium Association, Clearwater, FL",13736
"MIT, Cambridge, MA",12002
"Mitchell Boulevard, Fort Worth, TX",5410
"Mitchell College Historic District, Statesville, NC",11679
"Mitchell Field, Milwaukee, WI",5464
"Mitchell Park East, Tempe, AZ",7288
"Mitchell Park West, Tempe, AZ",6436
"Mitchell West, Milwaukee, WI",4264
"Mitman, Tucson, AZ",5877
"Mixon Town, Jacksonville, FL",12834
"MLK 183, Austin, TX",11903
"MLK Jr., Tuscaloosa, AL",14837
"MLK Park, Buffalo, NY",4469
"MLK, Austin, TX",11926
"Moanalua, Honolulu, HI",2902
"Mobel Americana, Saint Petersburg, FL",15598
"Mobile Terrace, Mobile, AL",6787
"Mobile-Bouie, Hattiesburg, MS",14648
"Mockingbird Hills, San Marcos, TX",15048
"Mockingbird Lake, Tulsa, OK",7568
"Modena, Philadelphia, PA",2035
"Moeller Heights, Tulsa, OK",6984
"Moffett Boulevard, Mountain View, CA",15007
"Mohawk, Eight Mile, AL",7038
"Mohican Regent, Detroit, MI",12570
"Molette, Moline, IL",9874
"Monclair, Jacksonville, FL",12895
"Moncrief Park, Jacksonville, FL",12529
"Mondamin Presidential, Des Moines, IA",5413
"Mondawin, Baltimore, MD",1439
"Monestary Heights, Cumberland, RI",9141
"Moneta Gardens, Hawthorne, CA",10422
"Monica Park Heights, Garland, TX",6183
"Monica Park, Garland, TX",4408
"Monkbridge Gardens, Albuquerque, NM",13017
"Monohan, Sammamish, WA",9588
"Monon, Lafayette, IN",9391
"Monroe Heights, Atlanta, GA",13485
"Monroe Lynfield, Rockville, MD",10905
"Monroe Park, Palo Alto, CA",6899
"Monroe Park, South Bend, IN",15609
"Monroe Ward, Richmond, VA",13130
"Monroe, Brooklyn Park, MN",9526
"Monsey, Ramapo, NY",2742
"Mont Marin-San Rafael Park, San Rafael, CA",15472
"Mont Pleasant, Schenectady, NY",2173
"Monta Loma, Mountain View, CA",14952
"Monta Vista North, Cupertino, CA",12979
"Monta Vista South, Cupertino, CA",14896
"Montalvo, Ventura, CA",8818
"Montavilla, Portland, OR",2636
"Montbello, Denver, CO",2480
"Montcastle Estates, Nashville, TN",8434
"Montclair Business, Oakland, CA",13624
"Montclair Lake Estates Homeowners Assoc, Clearwater, FL",13374
"Montclair, Augusta, GA",11912
"Montclair, Denver, CO",1153
"Montclair, Oakland, CA",3963
"Montclair, Quincy, MA",8912
"Montclaire South, Charlotte, NC",2792
"Montclare, Chicago, IL",577
"Monte Sano, Huntsville, AL",9527
"Monte Vista Estates, Harrisonburg, VA",15528
"Monte Vista, San Antonio, TX",1300
"Montebello, Ramapo, NY",1401
"Montecito Heights, Los Angeles, CA",3231
"Montecito Park, Glendale, CA",5723
"Montecito, Mesa, AZ",7912
"Montecito-Happy Valley, San Rafael, CA",15478
"Monterery, Roanoke, VA",2259
"Monterey Heights, San Francisco, CA",6302
"Monterey Vista, Chandler, AZ",7610
"Monterey Vista, Monterey, CA",10006
"Monterey, Jacksonville, FL",1638
"Monterey, Orlando, FL",12159
"Monterrey Terrace, Renton, WA",13790
"Monterrey Village HOA, San Antonio, TX",8196
"Montgomery Place, Nashville, TN",8400
"Montibello, Charlotte, NC",3823
"Monticello Park, Winston-Salem, NC",7488
"Monticello Village, Norfolk, VA",14190
"Monticello, Baton Rouge, LA",12906
"Monticello, Fort Worth, TX",1688
"Montlake, Seattle, WA",4370
"Montogue, Nashville, TN",7270
"Montopolis, Austin, TX",11900
"Montreux, Issaquah, WA",15098
"Montrose Verdugo City, Glendale, CA",3162
"Montrose, Rockville, MD",8933
"Montrose, Wakefield, MA",8913
"Montview, Winston-Salem, NC",7810
"Monument Avenue Park, Richmond, VA",7000
"Monument Beach, Bourne, MA",8675
"Moody Hills, Overland Park, KS",5746
"Moon Valley Heights, Columbia, MO",14982
"Mooncrest, Semmes, AL",6568
"Moondance, Mesa, AZ",7497
"Mooney, Visalia, CA",10409
"Moore, Fort Collins, CO",14345
"Moores Park, Lansing, MI",11363
"Moores, Boulder, CO",7373
"Mooretown and Hollywood Heights, Shreveport, LA",12466
"Moorings, Naples, FL",1528
"Moorland-Rimrock, Madison, WI",5277
"Moorlands, Kenmore, WA",9287
"Moorpark, Glendale, CA",4868
"Moose Can Gully, Missoula, MT",12513
"Moran Prairie, Spokane, WA",3137
"Moravia-Walther, Baltimore, MD",6025
"Moravian Forest, Winston-Salem, NC",6966
"Mordecai, Raleigh, NC",4593
"Morehead Hill, Durham, NC",14536
"Moreland, Charleston, SC",9147
"Moreland, Shaker Heights, OH",9101
"Morena, San Diego, CA",3052
"Moreno, Moreno Valley, CA",8819
"Morgan Heights, Milwaukee, WI",5341
"Morgan Park, Baltimore, MD",7442
"Morgan Park, Chicago, IL",498
"Morgan Park, Duluth, MN",8762
"Morgan Village, Camden, NJ",8714
"Morgandale, Milwaukee, WI",2961
"Morley Heights-Parkview, Duluth, MN",11544
"Morley, Dearborn, MI",9685
"Mormon Trek Village, Iowa City, IA",14702
"Morning Ridge, Gilbert, AZ",7713
"Morning Side, Pittsfield, MA",9864
"Morning Sunwood, Santa Ana, CA",4400
"Morning View, Nashville, TN",8318
